"","text_id","source_id","A_ID","text_title","text_subtitle","first_line","text_page","corpus","n_lines","meter","feet"
"1156","P_297","Per_434","A_130","Кокетке","","Не тревожь меня","C. 53-55","per",40,"Other","?"
"1157","P_298","Per_434","A_195","Красавице","Из Виктора Гюго","Цветок, на бабочку любуясь, повторял","C. 55-56","per",40,"Iamb","62"
"1158","P_299","Per_434","A_63","Русская пляска","","Не в лазури месяц новый","C. 57-58","per",33,"Trochee","4"
"1159","P_3","Per_435","A_137","","","На скованных зимой жестокою водах","C. 219","per",22,"Iamb","6"
"1160","P_30","Per_299","A_11","Сестра и братья","Песни западных славян","Два дубочка вырастали рядом","C. 26-29","per",119,"Other","?"
"1161","P_300","Per_434","A_157","Все пройдет","Элегия","Мне грустно… я молчу; пуская в душе волненье","C. 58-59","per",26,"Iamb","6"
"1162","P_301","Per_434","A_174","Баян","","Не Дон тихоструйный, плеская волнами","C. 59-60","per",43,"Amphibrach","4"
"1163","P_302","Per_434","A_63","Любовь и ревность","","Есть два чувства роковые","C. 61-62","per",34,"Trochee","4"
"1164","P_303","Per_434","A_155","Грусть паши","","Что сталось с ним, блистательным пашою","C. 62-64","per",56,"Iamb","5"
"1165","P_304","Per_436","A_155","Певец, к славянам перед отъездом на войну","","Славяне, настала пора отправленья","C. 95-96","per",56,"Amphibrach","4"
"1166","P_305","Per_437","A_248","Благовещение","Четыре христианские картины","Кто Ты, о Дева Назарета","C. 5-7","per",51,"Iamb","4"
"1167","P_306","Per_437","A_248","Рождество","","Идет звезда, всех звезд ясней","C. 7-8","per",54,"Iamb","4"
"1168","P_307","Per_437","A_248","Крещение","","Завет Господень исполнялся","C. 8-9","per",34,"Iamb","4"
"1169","P_308","Per_437","A_248","Христос на горе Елеонской","","Была ночь ясная. Мерцая","C. 9-11","per",40,"Iamb","4"
"1170","P_309","Per_437","","Кирхгоф","","Я на Кирхгоф попал случайно","C. 11-13","per",84,"Iamb","4"
"1171","P_31","Per_299","A_11","Яныш Королевич","Песни западных славян","Полюбил Яныш королевич","C. 29-32","per",96,"Other","?"
"1172","P_310","Per_437","","Новый завет","","Истерзан страстями, намучен сомненьем","C. 14-15","per",36,"Amphibrach","4"
"1173","P_311","Per_437","","Мысль и слово","","В младенчестве мира, как море, и суша","C. 15-16","per",56,"Amphibrach","4"
"1174","P_312","Per_438","A_159","Поэт","","Когда в живых мечтах горит душа поэта","C. 8-10","per",44,"Iamb","63"
"1175","P_313","Per_438","A_162","Из альбома Риццио","","Вчера, увенчанна алмазной диадимой","C. 10-11","per",24,"Iamb","6"
"1176","P_314","Per_438","A_159","Колыбельная песня","","Сном спокойным спи, младенец","C. 11-12","per",28,"Trochee","4"
"1177","P_315","Per_438","A_162","Леноре","","Ленора! с страхом и слезами","C. 13","per",16,"Iamb","4"
"1178","P_316","Per_438","A_159","Одиночество","","Все тихо и темно, повсюду сон глубокой","C. 14-15","per",28,"Iamb","6"
"1179","P_317","Per_438","A_159","Цыганка","","Жива как забава, как смех весела","C. 15-16","per",40,"Other","?"
"1180","P_318","Per_438","A_18","К — (при доставлении стихов моих)","","От ранних лет судьба мне указала","C. 157-158","per",29,"Iamb","v"
"1181","P_319","Per_438","A_159","Печаль вдохновения","","Остановись, мой грозный гений","C. 158-160","per",54,"Iamb","4"
"1182","P_32","Per_299","A_113","Тревожное раздумье","","Море синее, море бурное!","C. 120-122","per",48,"Trochee","4"
"1183","P_320","Per_438","A_252","Поэт и роза","Из Шекспира","Согрета первою весенней теплотой","C. 160-161","per",28,"Iamb","v"
"1184","P_321","Per_438","A_143","Сон","","Друзья! я видел сон чудесный","C. 161-163","per",53,"Iamb","4"
"1185","P_322","Per_438","A_159","Дума","","Во дни веселия надежда перед нами","C. 163-165","per",40,"Iamb","6"
"1186","P_323","Per_438","A_252","Пловец","Романс","Как ворона крылья, так черные тучи","C. 165-166","per",32,"Other","?"
"1187","P_324","Per_438","A_159","Перепутие","","Испытан раннею тоскою","C. 166-167","per",28,"Iamb","4"
"1188","P_325","Per_438","A_143","Моя молитва","","Творец! во прах перед Тобою","C. 168-171","per",100,"Iamb","4"
"1189","P_326","Per_438","A_159","Волга","","Как младенец боязлива","C. 171-172","per",28,"Trochee","4"
"1190","P_327","Per_439","A_18","Грехопадение","","В красоте, от праха взятой","C. 5-9","per",128,"Trochee","4"
"1191","P_328","Per_439","A_159","Стремление","","Земля человеку и мать и темница","C. 10-11","per",24,"Amphibrach","4"
"1192","P_329","Per_439","A_159","Награда поэта","","В часы забот и скуки хладной","C. 12-13","per",37,"Iamb","4"
"1193","P_33","Per_299","A_141","Песня закубанских горцев","","Не тигр с гиеною сдружился","C. 122-123","per",40,"Other","?"
"1194","P_330","Per_439","A_143","Дуб","","На стлани зелени волнистой","C. 14-15","per",44,"Iamb","4"
"1195","P_331","Per_439","A_143","Перемена","","Проходят дни безумного волненья","C. 16","per",16,"Iamb","5"
"1196","P_332","Per_439","A_159","Гроза","","Гроза над тобою, слепец дерзновенный","C. 127","per",8,"Amphibrach","4"
"1197","P_333","Per_439","A_159","Друзья","","Их было много - жребий мира","C. 127-128","per",16,"Iamb","4"
"1198","P_334","Per_439","A_143","Две музы","","С первой искрою сознанья","C. 128-131","per",108,"Trochee","4"
"1199","P_335","Per_439","A_252","Надежда","","Дайте очи мне орлиные","C. 132-133","per",36,"Trochee","4"
"1200","P_336","Per_439","A_51","Неаполь","","Неаполь! Неаполь! скажи - суждено ли","C. 133-134","per",28,"Other","?"
"1201","P_337","Per_440","","Романс","","Стой мой верный бурный конь","C. 5-6","per",36,"Other","?"
"1202","P_338","Per_440","A_143","Музыка","","Как небо южного восхода","C. 7-9","per",72,"Other","?"
"1203","P_339","Per_440","A_252","Терек","","Как незримых сил боренье","C. 9-11","per",52,"Other","?"
"1204","P_34","Per_299","A_142","Орел","","Когда пернатых царь стремится","C. 123-124","per",15,"Iamb","4"
"1205","P_340","Per_440","","Друзьям","","Друзья! оставьте утешенья!","C. 11-14","per",97,"Iamb","4"
"1206","P_341","Per_440","A_159","Три клада","","Во дни златой моей весны","C. 14-16","per",56,"Iamb","4"
"1207","P_342","Per_440","A_157","","Две элегии","Нет, нет! я схороню в душе моей глубоко","C. 85-86","per",24,"Iamb","6"
"1208","P_343","Per_440","A_157","","Две элегии","Весна. Опять весна! как сладко жизнью веет","C. 86","per",28,"Iamb","6"
"1209","P_344","Per_440","A_159","Ревность","","Я не люблю ее; но от чего порою","C. 87","per",20,"Iamb","6"
"1210","P_345","Per_440","A_143","Слезы","","Сладостны слезы для сердца в тоске безотрадной","C. 88","per",8,"Other","?"
"1211","P_346","Per_441","A_252","Поэту","","Певец любви, друг истины святой","C. 5-6","per",39,"Iamb","v"
"1212","P_347","Per_441","A_157","Полночный час","","Печально прогудел на башне час полночи","C. 7-8","per",32,"Iamb","6"
"1213","P_348","Per_442","A_162","Прощальная песня из недоконченной поэмы","","Простите, добрые друзья","C. 5-6","per",32,"Iamb","4"
"1214","P_349","Per_442","A_162","Жаворонок","","Между небом и землей","C. 7","per",16,"Trochee","43"
"1215","P_35","Per_299","A_50","Старый русский замок","","Где волной сребряно-шумной","C. 124-125","per",36,"Trochee","4"
"1216","P_350","Per_442","","Ночное свидание","","Тиха и безгласна Венеция дремлет","C. 8-10","per",90,"Amphibrach","4"
"1217","P_351","Per_442","","Могила","","По славу Аллаха! По воле Пророка","C. 11-12","per",62,"Amphibrach","4"
"1218","P_352","Per_442","A_211","Две зари на бородинской годовщине","","С час пробита заря","C. 13-16","per",102,"Iamb","4"
"1219","P_353","Per_442","","В альбом","","Мой жребий брошен!… Одинокий","C. 67-68","per",49,"Other","?"
"1220","P_354","Per_442","A_157","Стансы к…","","Страшись не сумрака могилы","C. 69-70","per",36,"Iamb","4"
"1221","P_355","Per_442","A_157","Ночь","","Погаснул день. На небо голубое","C. 70-72","per",52,"Iamb","5"
"1222","P_356","Per_442","A_211","Упрек Кавказу","","Над Кавказом ночь немая","C. 72-74","per",50,"Trochee","4"
"1223","P_357","Per_443","A_157","Мудрость","","О чем полны вы тяжких дум","C. 5-6","per",35,"Iamb","4"
"1224","P_358","Per_443","A_252","Грусть невесты","","О чем красавица грустит","C. 7-8","per",32,"Iamb","43"
"1225","P_359","Per_443","A_211","Дума на киргиз-кайсацкой степи","","Необозрима степь глухая","C. 8-11","per",88,"Iamb","4"
"1226","P_36","Per_299","A_113","Невеста","Элегия. Подражание Андрею Шенье","О что сбылось с тобой, невеста молодая","C. 126","per",28,"Iamb","6"
"1227","P_360","Per_443","A_157","Русская песня","","Много в небе горит","C. 11-12","per",48,"Other","?"
"1228","P_361","Per_444","","Джинны","Виктора Гюго","Сон очи","C. 34-38","per",120,"Other","?"
"1229","P_363","Per_445","A_152","К ***","","Зачем зовешь ее: Бесстрастная","C. 389-390","per",45,"Iamb","4"
"1230","P_364","Per_445","A_152","Песня","","Взгляни, мой друг - по небу голубому","C. 390-391","per",16,"Iamb","5"
"1231","P_365","Per_445","A_7","Великая тайна","","Тучи носят воду","C. 495-496","per",30,"Trochee","3"
"1232","P_366","Per_445","A_152","Молитва","Дума","Спаситель, Спаситель, Спаситель, мой Боже","C. 497","per",16,"Amphibrach","4"
"1233","P_367","Per_445","A_152","Звуки","Три стихотворения","Они уносят дух - властительные звуки","C. 498","per",8,"Iamb","v"
"1234","P_368","Per_445","A_152","Грусть","","Какая-то разгневанная сила","C. 489","per",8,"Iamb","5"
"1235","P_369","Per_445","A_152","Она…","","Как радостен отцу возврат младого сына","C. 499","per",13,"Iamb","v"
"1236","P_37","Per_299","A_143","Прощание с Петербургом","","Сокрылось солнце за Невою","C. 117-120","per",94,"Iamb","4"
"1237","P_370","Per_445","A_152","К ***","","Она бежит играющих подруг","C. 534-535","per",30,"Iamb","6"
"1238","P_371","Per_446","A_172","Ничего","В альбом","Есть словечко Ничего","C. 184-187","per",88,"Trochee","4"
"1239","P_372","Per_446","A_50","К Зевесу","","Зевес-громовержец, внемли мне, к тебе я взываю","C. 434","per",6,"Amphibrach","5"
"1240","P_373","Per_446","A_226","Воспоминание","","Кто отдаст мне молодость, время незабвенное","C. 465-466","per",28,"Trochee","84"
"1241","P_374","Per_446","A_226","Скала","","Скала наклонилась над бездной морской","C. 467-469","per",52,"Amphibrach","43"
"1242","P_375","Per_447","A_7","Косарь","","Не возьму я в толк","C. 295-299","per",126,"Other","?"
"1243","P_376","Per_447","","Моя степь","","Желал бы умчаться я в степь беспредельную","C. 413-414","per",30,"Amphibrach","4"
"1244","P_377","Per_448","","Синица","Старинная русская застольная песня","За морем Синица не в пешках жила","C. 218-221","per",72,"Other","?"
"1245","P_378","Per_448","A_226","Русская легенда","","Могилу рыли: мертвецу","C. 231-235","per",112,"Iamb","43434433"
"1246","P_379","Per_448","A_226","Степь","","Есть песня у меня старинная","C. 236-237","per",28,"Iamb","4"
"1247","P_38","Per_449","A_144","Победа Вакха","","Пирует бог вина румяный","C. 22-24","per",87,"Iamb","4"
"1248","P_380","Per_448","A_226","Орел и поэт","","Видал ли ты, когда орел","C. 238-239","per",18,"Iamb","4"
"1249","P_381","Per_448","A_226","Гроза","","Туча небо обтянула","C. 240-241","per",28,"Trochee","4"
"1250","P_382","Per_450","","Украйна","","Синее небо, черная степь","C. 265-266","per",36,"Other","?"
"1251","P_384","Per_451","A_172","Любовь поэта","","Какая грусть, какая мука","C. 168-170","per",52,"Iamb","4"
"1252","P_385","Per_452","","Два мгновения","","Мне знакомы два мгновенья","C. 24-25","per",26,"Trochee","4"
"1253","P_386","Per_452","A_26","Песня","","Разлюби меня, покинь меня","C. 51-52","per",24,"Trochee","4"
"1254","P_387","Per_453","","Жаворонок","","Предтечь весны, мой жаворонок","C. 298-300","per",56,"Iamb","4"
"1255","P_388","Per_454","","Текле","","Сбылись души моей желания","C. 338","per",16,"Iamb","4"
"1256","P_389","Per_454","A_26","Отчаяние","","О дайте мне кинжал и яд","C. 457-458","per",24,"Iamb","4"
"1257","P_39","Per_449","A_143","Русская песня","","Уж не цвесть цветку в пустыне","C. 171-172","per",20,"Trochee","4"
"1258","P_390","Per_455","A_15","Пешеходец","","Утро! Утро!… Небо ясно","C. 299-300","per",22,"Trochee","4"
"1259","P_391","Per_455","A_155","Моисей на реке Ниле","Посвящяется А.Г. Венециянову","О сестры, сестры! воды Нила","C. 301-305","per",108,"Iamb","4"
"1260","P_392","Per_456","A_149","На посещение его высокопревосходительством С.С. Уваровым, Московского университета","","В древнейшем храме наших Муз","C. 483","per",4,"Iamb","v"
"1261","P_393","Per_456","A_149","Ее превосходительству, Александре Петровне Дурасовой, при поднесении моих сочинений","","В чьи ж руки Муз своих, под чей же лучше кров","C. 484","per",14,"Iamb","v"
"1262","P_394","Per_456","A_149","К П.А. Мещеринову, подарившему автора настольным футляром для часов","","Вот истинно предмет живой","C. 484-485","per",20,"Iamb","4"
"1263","P_395","Per_456","A_149","К Ольге Вильгельмовне Штюмер, при подарке детскою музыкальною библиотекою","","Прими, дочь юная гармонии святой","C. 485","per",8,"Iamb","6"
"1264","P_396","Per_457","A_15","Старик","","Дедушка! скажи нам","C. 609-610","per",20,"Trochee","3"
"1265","P_397","Per_457","A_145","","Из Виктора Гюго","О крылья! крылья! Да к небесной","C. 610","per",10,"Iamb","4"
"1266","P_398","Per_457","A_145","","Из Виктора Гюго","Туда! туда! на крыльях бури","C. 610-611","per",10,"Iamb","4"
"1267","P_399","Per_457","A_145","Провидение","","Источник света, чистоты","C. 611-613","per",72,"Iamb","4"
"1268","P_4","Per_458","","","","Ужели напрасно","C. 242","per",34,"Amphibrach","other"
"1269","P_40","Per_449","A_113","Мальвина","","Цвела лилея полевая","C. 172-173","per",48,"Iamb","4"
"1270","P_400","Per_457","A_204","","Три стихотворения","Я, как отпадший Аббадона","C. 614","per",12,"Iamb","4"
"1271","P_401","Per_457","A_204","","Три стихотворения","Есть время, и я для любви возрождаюсь","C. 614","per",16,"Amphibrach","4"
"1272","P_402","Per_457","A_204","","Три стихотворения","Ваш взор, как вестник исцеленья","C. 615","per",14,"Iamb","4"
"1273","P_403","Per_459","A_15","Испанский романс","Из сочинения: Человек","В небесах луна златая","C. 247-249","per",56,"Trochee","4"
"1274","P_404","Per_459","A_15","Возвращение на родину","","Туманно солнышко взошло","C. 249-250","per",20,"Iamb","4"
"1275","P_405","Per_459","","Романс","Княжне ***","Не верю я! как с куклою, со мною","C. 250","per",16,"Iamb","5662"
"1276","P_406","Per_459","","К морю","","Море стонет, море воет","C. 251","per",16,"Trochee","4"
"1277","P_407","Per_459","A_175","Эпикурейская песнь","Из Новой Оперы","Наша жизнь суета","C. 252","per",18,"Anapest","other"
"1278","P_408","Per_460","A_15","Поцелуй","","Ветер свищет, ветер воет","C. 351-352","per",40,"Trochee","4"
"1279","P_409","Per_460","A_15","Тиролец","Ее Превосх. Н.И. Л-г","Я горд. Но не ищите злобы","C. 353-354","per",40,"Iamb","4"
"1280","P_41","Per_449","A_144","Призраки","Из Виктора Гюго","Сколько дев, и юных, и прекрасных","C. 173-180","per",200,"Trochee","5"
"1281","P_410","Per_461","A_155","К демону","","Демон, демон! где ты ныне","C. 166-168","per",65,"Trochee","4"
"1282","P_411","Per_461","A_155","Молодая аравитянка","Газель","Калем, калем! я полн одушевленья","C. 169-170","per",36,"Iamb","v"
"1283","P_412","Per_461","A_175","Искушение","","Зачем склонила мне на грудь свою главу","C. 170-171","per",8,"Iamb","6"
"1284","P_413","Per_461","","Зяблик и соловей","","Куда летишь, товарищ милый","C. 171-172","per",48,"Iamb","4"
"1285","P_414","Per_461","A_175","Эпиграмма","","Бессмертья ради ты писал","C. 173","per",4,"Iamb","4"
"1286","P_415","Per_462","","Грезы счастия","","Я засыпал под свистом бури","C. 276-277","per",18,"Iamb","v"
"1287","P_416","Per_462","","Послание к N.N.","","Взгляни как дня взойдет светило","C. 277","per",16,"Iamb","4"
"1288","P_417","Per_463","","Моей звездочке","К. Ф. Ю…ъ","Я помню ночь; с закатом дня","C. 163","per",24,"Iamb","4"
"1289","P_418","Per_464","A_218","Вельможа","","Какой-то в древности вельможа","C. 64","per",25,"Iamb","v"
"1290","P_419","Per_465","A_193","Пир","","И я попал на дивный жизни пир","C. 258-259","per",41,"Iamb","v"
"1291","P_42","Per_449","A_5","Весна","","Весна! И солнце запылало","C. 180-182","per",64,"Iamb","4"
"1292","P_420","Per_466","A_146","Великий","","Змеится молния. По бурным облакам","C. 51","per",16,"Iamb","4"
"1293","P_421","Per_466","A_146","Ночь","","Ночь земли! Твой вид прекрасен","C. 52","per",16,"Trochee","4"
"1294","P_422","Per_467","A_38","Романс","","Не горюй, душа-девица","C. 156","per",24,"Trochee","4"
"1295","P_423","Per_467","A_38","Сравнение","","Когда найдет на светлый ум","C. 157","per",30,"Iamb","4"
"1296","P_424","Per_468","","Могила","","Она возьмет меня и передаст мой прах","C. 294","per",20,"Iamb","6"
"1297","P_425","Per_468","","Страсти","","Без них душа и ум не нужны были б мне","C. 295","per",8,"Iamb","6"
"1298","P_426","Per_468","","Счастливец","","Блажен, кто с горем не встречался","C. 295-296","per",20,"Iamb","4"
"1299","P_427","Per_468","","Порой","","Порою сердце сладко бьется","C. 296","per",20,"Iamb","4"
"1300","P_428","Per_469","A_146","Песнь слепца","","О Деннмарк! ты сад цветистый","C. 354-356","per",48,"Trochee","4"
"1301","P_429","Per_469","","На спуск военного парохода Богатырь","","Ура, наш Богатырь! Ура","C. 356","per",25,"Iamb","4"
"1302","P_43","Per_470","A_143","Первая любовь","","Я понял, я знаю всю прелесть любви","C. 5-7","per",60,"Amphibrach","43"
"1303","P_430","Per_471","","Басня","Быль","На небе зарево, на улицах толпятся","C. 36","per",46,"Iamb","v"
"1304","P_431","Per_472","","Преложение псалма. Благослови, душе моя, Господа","","Благослови Царя вселенной","C. 85-89","per",144,"Iamb","4"
"1305","P_432","Per_406","A_162","К Леоноре","","Есть имена любовника, супруга","C. 3","per",13,"Iamb","5"
"1306","P_433","Per_406","A_50","Дунай","","Бегут, шумят, теснятся волны","C. 6-8","per",40,"Iamb","4"
"1307","P_434","Per_473","A_155","Песня пиратов","","Мы христиан без счету били","C. 149-151","per",40,"Iamb","4"
"1308","P_435","Per_473","A_213","Лезгинскому кинжалу","","Оставь, красавица, сей пагубный кинжал","C. 151","per",12,"Iamb","6"
"1309","P_436","Per_473","A_50","Рок","","Выплывая из-за тучи","C. 152","per",15,"Trochee","4"
"1310","P_437","Per_474","","Путешественник","Вечер на Малоазийском берегу Средиземного Моря, близ города Анталии","Стой, добрый конь мой, отдохни минуту","C. 419-423","per",102,"Iamb","5"
"1311","P_438","Per_474","A_50","Москва","","Москва! Москва! твой Кремль красноречивый","C. 423-424","per",14,"Iamb","6"
"1312","P_439","Per_474","A_168","Уран","","В восемьдесят три года свершитель планетной системы","C. 424","per",4,"Other","?"
"1313","P_44","Per_475","A_145","Небеса","","Снова брачною одеждой","C. 13-15","per",64,"Trochee","4"
"1314","P_440","Per_476","A_36","Буря","","Подернулось небо громадами туч","C. 3-4","per",31,"Amphibrach","4"
"1315","P_441","Per_476","A_50","Подражание Саади","","Я надену тюрбан","C. 4-5","per",21,"Anapest","2"
"1316","P_442","Per_476","A_155","Не измени!","","Твоя живая красота","C. 5-6","per",40,"Iamb","4"
"1317","P_443","Per_477","A_37","К коню","","Ах ты, конь мой, добрый конь","C. 137-130","per",64,"Trochee","4"
"1318","P_444","Per_477","A_198","К П.Н. Ч-ву","","Довольно покурил ты в жизни, Ч-в","C. 140","per",16,"Iamb","v"
"1319","P_445","Per_477","A_216","Песнь страдальца","","Разломайся грудь","C. 141-142","per",40,"Other","?"
"1320","P_446","Per_477","A_146","Все бьются, биты и все бьют","","Обширен свет, а люди бьются","C. 143-146","per",72,"Iamb","4"
"1321","P_447","Per_478","A_155","Последняя любовь","","Была пора: в безумном исступленьи","C. 281-282","per",15,"Iamb","5"
"1322","P_448","Per_478","A_50","Крестоносец","","В печальном раздумьи пред девой младою","C. 282-283","per",26,"Amphibrach","4"
"1323","P_449","Per_478","A_50","Женщине-поэту","","Не уста твои сахарны","C. 283-284","per",20,"Trochee","4"
