"","text_id","source_id","A_ID","text_title","text_subtitle","first_line","text_page","corpus","n_lines","meter","feet"
"2294","C_118__6","C_118","A_31","Хор дев израильских","","Вселенная полна Господней лепотою;
","C. 20-25","col",40,"Iamb","v"
"2295","C_118__7","C_118","A_31","Рай Магомета","","Так Пророк гремел речами ,","C. 26-28","col",20,"Trochee","4"
"2296","C_118__8","C_118","A_31","Триумф баллады","","Хвала тебе, балладный гений !","C. 29","col",4,"Iamb","4"
"2297","C_118__9","C_118","A_31","Она","","Она мила, она прекрасна ,","C. 30","col",4,"Iamb","4"
"2298","C_118__10","C_118","A_31","Новобрачным","","Не хвались, Филат, пирами","C. 31","col",4,"Trochee","4"
"2299","C_121__1","C_121","","1_NA ","","Для вас красавицы, любовь","C. NA","col",10,"Iamb","4"
"2300","C_121__2","C_121","","2_NA","","Султанша гордая гарема,","C. NA","col",18,"Iamb","v"
"2301","C_121__3","C_121","","3_NA","","Вы так прекрасны и скромны","C. NA","col",19,"Iamb","4"
"2302","C_121__4","C_121","","4_NA","","Вы милы так, вы так прекрасны","C. NA","col",16,"Iamb","4"
"2303","C_121__5","C_121","","5_NA","","Не скрыли вы маской, прекрасныя очи","C. NA","col",18,"Amphibrach","4"
"2304","C_121__6","C_121","","6_NA","","Дивлюсь смешению! — стан гибкий и прекрасный","C. NA","col",15,"Iamb","6"
"2305","C_121__7","C_121","","7_NA","","С такою миленькой головкой","C. NA","col",14,"Iamb","4"
"2306","C_121__8","C_121","","8_NA","","Звезда над головой, волшебный жезл в руках. .","C. NA","col",17,"Iamb","6"
"2307","C_121__9","C_121","","9_NA","","Одеться дикою любовь вас научила —","C. NA","col",16,"Iamb","6"
"2308","C_122__1","C_122","","Мечта","","Кто там задумчив при луне ,","C. 3-4","col",44,"Iamb","4"
"2309","C_122__2","C_122","","К ней","","Не для меля очарованья","C. 5","col",4,"Iamb","4"
"2310","C_122__3","C_122","","Романс","","Прости Алина! за Царя!...","C. 5-6","col",26,"Iamb","4"
"2311","C_122__4","C_122","",NA,"","Ты так печально не гляди ,","C. 6-7","col",28,"Iamb","4"
"2312","C_122__5","C_122","","Предчувствие","","Друзья сбирайтеся ко мне,","C. 7-8","col",28,"Iamb","4"
"2313","C_122__6","C_122","","Завещание","","Ах, кончен жизни скорбный путь","C. 9-10","col",40,"Iamb","4"
"2314","C_122__7","C_122","","Буря","","Давно был с вами я знаком","C. 10-11","col",20,"Iamb","4"
"2315","C_122__8","C_122","","Преступник","","Друзья , друзья ! Ах, может быть","C. 11-12","col",12,"Iamb","4"
"2316","C_122__9","C_122","","К А... У... Н...","","Одним я любуюсь лишь в жизни моей,","C. 12","col",8,"Amphibrach","4"
"2317","C_122__10","C_122","","Ее тень","","Внимая звук волшебный лиры","C. 13","col",20,"Iamb","4"
"2318","C_122__11","C_122","",NA,"","На небе чистом засребрилась","C. 14-15","col",39,"Iamb","4"
"2319","C_122__12","C_122","","Очи","","Скажите мне!.. Где эти очи ,","C. 15-16","col",16,"Iamb","4"
"2320","C_122__13","C_122","","Последнее желание","","Я помню тот счастливый час,","C. 16-18","col",37,"Iamb","4"
"2321","C_122__14","C_122","","Пловец","","Ты не вей мой ветерок -","C. 18-19","col",32,"Trochee","4"
"2322","C_122__15","C_122","","Романс","","Прошу тебя, не вспоминай","C. 20","col",20,"Iamb","4"
"2323","C_122__16","C_122","","Романс","","Не угасай моя Лампада ,","C. 21","col",16,"Iamb","4"
"2324","C_122__17","C_122","","1. В альбом М.И. Ш...б","","За чем; скажи, пылают очи","C. 22","col",4,"Other","?"
"2325","C_122__18","C_122","","2. К.Г.Г...ер","","Тебя я видел - Ангел мой, ","C. 22-23","col",32,"Iamb","43"
"2326","C_122__19","C_122","","3","","О друг бесценный, друг мой милый","C. 24","col",24,"Iamb","4"
"2327","C_122__20","C_122","","4","","Оставь меня в оковах ржавых,","C. 25-26","col",20,"Iamb","4"
"2328","C_122__21","C_122","","5","","В тиши ночной один , мечтая,","C. 26-27","col",28,"Iamb","4"
"2329","C_124__1","C_124","A_33","Отцвет","","Наконец моя Людмила,","C. 95","col",20,"Trochee","4"
"2330","C_124__2","C_124","A_33","Туда! Туда!","","Лети прямей, послушное ветрило,","C. 96","col",18,"Iamb","5"
"2331","C_124__3","C_124","A_33","К Китти","","Нежных персей колебанье,","C. 97","col",24,"Trochee","4"
"2332","C_124__4","C_124","A_33","А... Ф... А-вой","","Скажите мне: где обитает радость?","C. 98-99","col",28,"Iamb","v"
"2333","C_124__5","C_124","A_33","Бор","","По небу осеннему сизые тучи","C. 99-101","col",48,"Amphibrach","4"
"2334","C_124__6","C_124","A_33","Минувшее","","Нет! не забыться мне, волшебница младая,","C. 119","col",24,"Iamb","v"
"2335","C_124__7","C_124","A_33","Днепр","","От приморских степей ураган налетел;","C. 120","col",20,"Anapest","4"
"2336","C_124__8","C_124","A_33","Сонет","","Я помню время : предо мною","C. 121","col",14,"Iamb","4"
"2337","C_124__9","C_124","A_33","Разочарование ","П.Е. Урюпину","Завет минувшего! торжественный завет!","C. 122-123","col",32,"Iamb","v"
"2338","C_124__10","C_124","A_33","Сокол","","На верху скалы высокой,","C. 161","col",22,"Trochee","4"
"2339","C_124__11","C_124","A_33","Безумие","","Бесстрастные очи вперивши на темное небо,","C. 162","col",20,"Anapest","other"
"2340","C_124__12","C_124","A_33","Надпись к памятнику Александр I-го в Таганроге ","","О, Тень великая! Отец наш незабвенный!","C. NA","col",8,"Iamb","6"
"2341","C_124__13","C_124","A_33","Талисман","","Я помню то время, когда в тишине","C. 231","col",18,"Amphibrach","4"
"2342","C_124__14","C_124","A_33","Мечта","","Уйдем, уйдем мечта моя младая","C. 232","col",16,"Iamb","6"
"2343","C_124__15","C_124","A_33","Персидская песня ","С польского","Ты хочешь видеть прелесть Мая —","C. 232-233","col",31,"Iamb","4"
"2344","C_124__16","C_124","A_33","К ...е","","Я не скажу тебе о счастьи прежних дней","C. 234","col",18,"Iamb","v"
"2345","C_124__17","C_124","A_33","Вам","","О, не страшись последствии наслаждений,","C. 235","col",16,"Iamb","v"
"2346","C_124__18","C_124","A_33","Элегия","","Когда затворником по воле","C. 236","col",22,"Iamb","4342"
"2347","C_124__19","C_124","A_33","Jenny ","Посв. брату А.Д. Саранчову","В роскошной свежести мечтаний юных лет,","C. 249","col",32,"Iamb","6"
"2348","C_124__20","C_124","A_33","П.И. И...ву","","Кому я посвящу задумчивые звуки,","C. 251-252","col",32,"Iamb","v"
"2349","C_124__21","C_124","A_33","Стихи Калифа Авдерамана I на пальму, посаженную им в саду в Кордове","","Прекрасная Пальма ! высокая Пальма !","C. 258-259","col",24,"Amphibrach","4"
"2350","C_124__22","C_124","A_33","Участие","","Я тосковал. ——","C. 260","col",25,"Iamb","v"
"2351","C_124__23","C_124","A_33",NA,"","Пойми меня! залогом думы нежной","C. 261","col",20,"Iamb","5"
"2352","C_124__24","C_124","A_33","Застольная песнь ","С. Х. У.","Товарищи! други! в сей час ликованья","C. 262","col",24,"Amphibrach","4"
"2353","C_124__25","C_124","A_33","11-е апреля 1835","","Берег! берег! дружно, други,","C. 263-264","col",28,"Other","?"
"2354","C_124__26","C_124","A_33","Италия","","В стране чудес, в стране мечтаний знойных","C. 264-266","col",40,"Iamb","v"
"2355","C_124__27","C_124","A_33","Полночь","","Полночь — тихо!... Месяц скрылся.","C. 266-267","col",20,"Trochee","4"
"2356","C_124__28","C_124","A_33","В альбом Л.П. В...ой","","В стране роскошного Востока","C. 274","col",19,"Iamb","4"
"2357","C_124__29","C_124","A_33","Гость","","За дубовым столом","C. 275-280","col",138,"Anapest","2"
"2358","C_124__30","C_124","A_33","Элегия","","По тем местам, где прежде я, счастливый,","C. 281","col",20,"Iamb","54"
"2359","C_124__31","C_124","A_33","Певице ...ой","","Волшебница! полно, не пой про любовь:","C. 284","col",20,"Amphibrach","4"
"2360","C_125__1","C_125","A_271","Чувства юноши при виде памятника Императору Александру Благословенному","","Певец, опершись о гранит,","C. 1-2","col",20,"Iamb","4"
"2361","C_125__2","C_125","","Смерть Бориса Ростовского ","Историческое предание","Ночь воцарилась, над горой","C. 14-22","col",165,"Iamb","4"
"2362","C_125__3","C_125","A_42","Мои мечты","","В часы спокойствия, в часы уединенья,","C. 25-27","col",12,"Iamb","6"
"2363","C_125__4","C_125","","Осень","","Давно ли Аврора","C. 48-51","col",67,"Amphibrach","2"
"2364","C_125__5","C_125","","Курица и утка ","Басня","Куда как ты умна!","C. 52-53","col",15,"Iamb","v"
"2365","C_125__6","C_125","","К А.Е. Грену","","В волненьи дум, в пылу страстей,","C. 54-55","col",16,"Iamb","4"
"2366","C_125__7","C_125","A_271","Звезда ","Аллегория","Был вечер. Звездочка сверкала.","C. 56","col",8,"Iamb","4"
"2367","C_125__8","C_125","","Бальные друзья","","Как я люблю тебя мой друг!","C. 91-92","col",17,"Iamb","v"
"2368","C_125__9","C_125","","К сослуживцам","","Прощайте добрые друзья","C. 93-96","col",51,"Iamb","4"
"2369","C_125__10","C_125","","Мечты на берегах черного моря","","Спешит уж солнце утопать","C. 101-103","col",44,"Iamb","4"
"2370","C_125__11","C_125","","К Г-ну","","Люблю того, кто убежал","C. 104-105","col",20,"Iamb","4"
"2371","C_125__12","C_125","","В память Веневитинову","","Чудесный жребий песнопенья","C. 115-117","col",32,"Iamb","4"
"2372","C_125__13","C_125","","Из Гейера","","Как сладко в поздние часы","C. 120","col",8,"Iamb","4"
"2373","C_125__14","C_125","","К Ш...","","Быстро время исчезает","C. 123-124","col",26,"Trochee","4"
"2374","C_125__15","C_125","","Эпиграмма","","Клит никому не подражает,","C. 125","col",4,"Iamb","4"
"2375","C_125__16","C_125","","Чумаки","","Налег туман уж над водою","C. 129-132","col",48,"Iamb","4"
"2376","C_125__17","C_125","","Размолвка","","Нет! обольстительных сетей","C. 133-134","col",16,"Iamb","4"
"2377","C_125__18","C_125","","Пустыня ","А.Е. Грену","Забуду ль я, твой мрачный вид,","C. 175-176","col",27,"Iamb","v"
"2378","C_125__19","C_125","","К N.N.","","Приезжай на пир веселый","C. 177-179","col",38,"Other","?"
"2379","C_125__20","C_125","","Звезда","","Звезда! как светло блещешь ты,","C. 180-181","col",12,"Iamb","4"
"2380","C_125__21","C_125","","Слеза","","Слеза, горючая слеза!","C. 186-187","col",12,"Iamb","4"
"2381","C_125__22","C_125","","Экспромт","","Вы мне сказали не шутя,","C. 188","col",5,"Other","?"
"2382","C_125__23","C_125","A_271","Сухачеву ","В Одессу","Прошли надежды — лучших лет,","C. 189-191","col",38,"Iamb","4"
"2383","C_125__24","C_125","","Невозможность счастия","","Как счастье к нам придет,","C. ","col",4,"Iamb","v"
"2384","C_125__25","C_125","","К другу","","Угрюмый баловень безделья,","C. 202","col",8,"Iamb","4"
"2385","C_125__26","C_125","A_42","К ***","","Товарищ - друг ! со дня рожденья","C. 203-204","col",16,"Iamb","4"
"2386","C_125__27","C_125","","К ***","","Нет не в силах боле я","C. 205-206","col",24,"Other","?"
"2387","C_128__1","C_128","A_34","Читателю","","Читатель! может быть, иным","C. 5","col",16,"Iamb","v"
"2388","C_128__2","C_128","A_34","Горлинка и соловей ","Басни ","Одна из Горлинок, лишась подруги нежной,","C. 7-8","col",24,"Iamb","v"
"2389","C_128__3","C_128","A_34","Витязь и конь ","Басни ","Какой - то Витязь отправлялся","C. 9-10","col",27,"Iamb","v"
"2390","C_128__4","C_128","A_34","Своевольная собака ","Басни ","Собака рыскала в селении по воле,","C. 11-12","col",20,"Iamb","v"
"2391","C_128__5","C_128","A_34","Волк и овца ","Басни ","От стада уклонясь Овца во время зноя","C. 13-14","col",30,"Iamb","v"
"2392","C_128__6","C_128","A_34","Скворец ","Басни ","СКВОРЕЦ.","C. 15","col",18,"Iamb","v"
"2393","C_128__7","C_128","A_34","Богатая лисица ","Басни","Богатая Лиса увидев бедняка ","C. 16-17","col",24,"Iamb","v"
"2394","C_128__8","C_128","A_34","Осел и сурок ","Басни ","Осел, сидя на воеводстве,","C. 21-22","col",29,"Iamb","v"
"2395","C_128__9","C_128","A_34","Лисица и бобр ","Басни ","Лисица быв Судьей в курятнике одном.","C. 23","col",17,"Iamb","v"
"2396","C_128__10","C_128","A_34","Слон и сурок ","Басни ","Увидя Слон Сурка,","C. 24-25","col",18,"Iamb","v"
"2397","C_128__11","C_128","A_34","Домашняя ссора ","Басни","Однокорытники - Угар и Удалой,","C. 26-27","col",17,"Iamb","v"
"2398","C_128__12","C_128","A_34","Вороны ","Басни ","Ворон большая стая","C. 28-29","col",19,"Iamb","v"
"2399","C_1292__1","C_1292","A_298","Ек... Ив... Б.л.г.в.кой","","Желает воин битв, побед;","C. 1","col",13,"Iamb","4"
"2400","C_131__1","C_131","A_302","Грусть на чужбине ","Письмо к другу","Чем я начну, — о чем писать,","C. 220-222","col",68,"Iamb","4"
"2401","C_131__2","C_131","A_302","Воспоминание о сестре","","Сестра! — давно ли ты жила ?","C. 223-224","col",36,"Iamb","4"
"2402","C_131__3","C_131","A_302","Измена","","И я знал счастье в прежни лета","C. 225-226","col",48,"Iamb","42"
"2403","C_131__4","C_131","A_302","Вино","","Летучей пеною вздымаясь,","C. 227","col",24,"Iamb","4"
"2404","C_131__5","C_131","A_302","Вопрос","","Младая дева красоты","C. 228","col",12,"Iamb","4"
"2405","C_131__6","C_131","A_302","К Е.А.М.","","Я чушь дышу,","C. 229-230","col",32,"Iamb","2"
"2406","C_131__7","C_131","A_302","К другу","","Нет, милый друг, не беспокойся:","C. 231","col",20,"Iamb","4"
"2407","C_131__8","C_131","A_302","Делии","","О, шалунья Деля!","C. 232","col",16,"Other","?"
"2408","C_131__9","C_131","A_302","Утрата","","Как черная туча в час бури ужасной","C. 233","col",16,"Amphibrach","43"
"2409","C_131__10","C_131","A_302","Разочарованный","","Поверьте, ваша мне улыбка","C. 234","col",12,"Iamb","4"
"2410","C_131__11","C_131","A_302","К Е...","","Легкий стан, воздушный , нежный","C. 235","col",12,"Trochee","4"
"2411","C_131__12","C_131","A_302","Желание","","Воздушных замков не имею,","C. 236","col",16,"Iamb","4"
"2412","C_131__13","C_131","A_302","К ней","","Прости восторг, прости веселье!","C. 237","col",12,"Iamb","4"
"2413","C_131__14","C_131","A_302","К мальчику","","Мальчик резвый и прекрасный","C. 238","col",12,"Trochee","4"
"2414","C_131__15","C_131","A_302","Василек","","Как мало цвел он в дикой воле.","C. 239","col",16,"Iamb","4"
"2415","C_131__16","C_131","A_302","Вызов","","Выходи скорей, Лилета,","C. 240","col",12,"Trochee","4"
"2416","C_131__17","C_131","A_302","Противоположность","","Нищий просит: -- дайте хлеба?","C. 241","col",8,"Trochee","4"
"2417","C_131__18","C_131","A_302","Песня","","Что ты девица, красавица моя,","C. 242","col",19,"Trochee","6"
"2418","C_131__19","C_131","A_302","Ратмир и Эмма","","Скоро скачет ездок","C. 243-246","col",76,"Anapest","2"
"2419","C_131__20","C_131","A_302","Я помню вас!...","","Я помню вас, я помню вас,","C. 247","col",25,"Iamb","4"
"2420","C_131__21","C_131","A_302","Локону","","Локон русый , шелковистый,","C. 248","col",19,"Trochee","4"
"2421","C_131__22","C_131","A_302","К - О","","Не видеть больше мне тебя","C. 249","col",20,"Iamb","4"
"2422","C_131__23","C_131","A_302","Акростих","","Не верил я моей надежде ,","C. 250","col",7,"Iamb","4"
"2423","C_131__24","C_131","A_302","Надгробие гарсону","","Гарсон! ты двадцать лет мне с честию служил:","C. 250","col",4,"Iamb","v"
"2424","C_131__25","C_131","A_302","Эпиграммаю. 4.","","""Продайте Клима мне портрет!?""","C. 251","col",4,"Other","?"
"2425","C_141__1","C_141","A_37","I","","Когда ничтожество земное разгадалось:","C. 1-7","col",144,"Iamb","6"
"2426","C_141__2","C_141","A_37","Девица за арфою","","Слышишь? Страстию дыша,","C. 8-9","col",24,"Trochee","4"
"2427","C_141__3","C_141","A_37","III","","Непроницаемые ели,","C. 10-11","col",80,"Iamb","4"
"2428","C_141__4","C_141","A_37","IV","","Те дерева, под сенью коих","C. 15-17","col",48,"Iamb","4"
"2429","C_141__5","C_141","A_37","V. Подсолнечник","","Цвет солнца! над грядой печальной, обнаженной,","C. 18-20","col",49,"Iamb","v"
"2430","C_141__6","C_141","A_37","VI","","Вы так милы, так прекрасны,","C. 21-22","col",36,"Trochee","4"
"2431","C_141__7","C_141","A_37","VII","","Земной любви -- любовь земная","C. 23-26","col",72,"Iamb","4"
"2432","C_141__8","C_141","A_37","VIII","","Стройные полки идут,","C. 27-29","col",45,"Trochee","44442"
"2433","C_141__9","C_141","A_37","IX","","Не позволяй ни одного лобзанья","C. 30-33","col",56,"Iamb","5553"
"2434","C_141__10","C_141","A_37","X. Река зимою","","Как весело она бежала","C. 34-35","col",28,"Iamb","4"
"2435","C_141__11","C_141","A_37","XI","","Умолкни, грудь! ты дышишь недостойным,","C. 36-38","col",47,"Iamb","v"
"2436","C_141__12","C_141","A_37","XII","","Когда тебя к престолу Бога","C. 39-40","col",20,"Iamb","4"
"2437","C_141__13","C_141","A_37","XIII","","Блеск черных глаз потух; коральные уста","C. 41-44","col",60,"Iamb","6"
"2438","C_141__14","C_141","A_37","XIV","","Как полк великанов, проходят скалы,","C. 45-46","col",18,"Other","?"
"2439","C_141__15","C_141","A_37","XV","","За чем толпой по улице народ","C. 47-50","col",64,"Iamb","55555566"
"2440","C_141__16","C_141","A_37","XVI","","Теперь она давно почила,","C. 51-52","col",20,"Iamb","4"
"2441","C_141__17","C_141","A_37","XVII","","Уже твоя грудь округлилась,","C. 53-58","col",104,"Iamb","4"
"2442","C_141__18","C_141","A_37","XVIII","","Румянец розовых щек,","C. 59-61","col",32,"Amphibrach","3"
"2443","C_141__19","C_141","A_37","XIX","","Рассекая ветр нагорный","C. 62-64","col",36,"Trochee","4"
"2444","C_141__20","C_141","A_37","XX","","Едва сомкнул глаза — я снится мне, что ты","C. 65-67","col",50,"Iamb","6"
"2445","C_141__21","C_141","A_37","XXI. К коню","","Ах ты конь мой, добрый конь","C. 68-71","col",64,"Trochee","4"
"2446","C_141__22","C_141","A_37","XXII.I","","Пышен бал,... как сотни лун, кинкеты","C. 72-73","col",28,"Trochee","5"
"2447","C_141__23","C_141","A_37","XXII.II","","Вот идет воздушная блондинка,","C. 74-76","col",52,"Trochee","5"
"2448","C_141__24","C_141","A_37","XXII.III","","В отдаленьи от гостей и зала","C. 76-77","col",12,"Trochee","5"
"2449","C_141__25","C_141","A_37","XXII.IV","","Нет его, не жди его напрасно!","C. 77","col",16,"Trochee","5"
"2450","C_141__26","C_141","A_37","XXIII","","Мои мечты, мои виденья —","C. 78-79","col",20,"Iamb","4"
"2451","C_141__27","C_141","A_37","XXIV","","Сердца тягостная рана","C. 80-81","col",24,"Trochee","4"
"2452","C_141__28","C_141","A_37","XXV. Зимний поход","","""Потусклый месяц побледнел,","C. 82-84","col",48,"Iamb","4"
"2453","C_141__29","C_141","A_37","XXVI","","Когда бы небеса, пред смертию моей,","C. 85-86","col",12,"Iamb","6"
"2454","C_141__30","C_141","A_37","XXVII","","Ветр осенний, тонкий, резкий","C. 87-90","col",74,"Trochee","4"
"2455","C_141__31","C_141","A_37","XXVIII","","О если б в это самое мгновенье,","C. 91","col",12,"Iamb","v"
"2456","C_141__32","C_141","A_37","XXIX","","Порой любовь твоя на сердце счастьем веет,","C. 92-93","col",28,"Iamb","6"
"2457","C_141__33","C_141","A_37","XXX. Рассказы из турецкой войны. Река Ольга","","XXX.","C. 94-104","col",196,"Amphibrach","4"
"2458","C_141__34","C_141","A_37","XXXI. Прощание","","Когда луна из тучи выплывает,","C. 105-109","col",84,"Iamb","5553"
"2459","C_141__35","C_141","A_37","XXXII. Скорбь Елены-Молдованки","","Я сегодня в огороде","C. 110-1112","col",58,"Trochee","43"
"2460","C_141__36","C_141","A_37","XXXIII. Ренегат ","Перевод","Что случилося не давно в Иране,","C. 113-115","col",36,"Other","?"
"2461","C_141__37","C_141","A_37","XXXIV. Фетфа негритянка","","Обнаженною стопой","C. 116-123","col",168,"Trochee","4"
"2462","C_141__38","C_141","A_37","XXXV. Стануй и Деспа","","Собрался на бой Стануй","C. 124-130","col",94,"Other","?"
"2463","C_141__39","C_141","A_37","XXXVI. Паша","","Паша был светел; в сладкой лени","C. 131-133","col",80,"Iamb","v"
"2464","C_141__40","C_141","A_37","XXXVII. Любовь африканца","","Хетр без сабли и кинжала,","C. 136-140","col",98,"Trochee","4"
"2465","C_141__41","C_141","A_37","XXXVIII. Видение","","В то время трупы, огнь валились на поля;","C. 143-166","col",544,"Iamb","6"
"2466","C_142__1","C_142","A_38","Письмо первое","","Граф! увенчали вы вполне","C. 1-6","col",110,"Iamb","4"
"2467","C_142__2","C_142","A_38","Письмо второе","","Еще на путевых страницах","C. 9-27","col",430,"Iamb","4"
"2468","C_142__3","C_142","A_38","Письмо третье","","Осенним солиден уж согрета","C. 31-49","col",484,"Iamb","4"
"2469","C_142__4","C_142","A_38","Письмо четвертое","","Чтоб нега жизни деревенской","C. 55-68","col",304,"Iamb","4"
"2470","C_142__5","C_142","A_38","Письмо пятое","","Сказав прости стране любимой,","C. 70-83","col",306,"Iamb","4"
"2471","C_142__6","C_142","A_38","Письмо шестое","","Мы, с каждым днем встречая снова","C. 88-99","col",285,"Iamb","4"
"2472","C_142__7","C_142","A_38","Письмо седьмое","","Когда младый птенец орлиный,","C. 102-121","col",439,"Iamb","4"
"2473","C_142__8","C_142","A_38","Письмо осьмое","","Властитель моря — Севастополь ,","C. 128-144","col",383,"Iamb","4"
