"","text_id","source_id","A_ID","text_title","text_subtitle","first_line","text_page","corpus","n_lines","meter","feet"
"1","P_1","Per_1","","Солдатская песня","","Ох жизнь, молодецкая","C. 46","per",38,"Other","?"
"2","P_10","Per_2","A_50","Молния","","Зачем с небесной высоты","C. 21","per",16,"Iamb","3"
"3","P_100","Per_3","A_7","Ночлег чумаков","Сельские картины","В близи дороги столбовой","C. 9-12","per",98,"Iamb","4"
"4","P_1000","Per_4","A_41","Утешитель","","О чем грустишь так неутешно","C. 172-174","per",77,"Iamb","4"
"5","P_1001","Per_4","A_139","Город","","Движим думою чудесной","C. 175-176","per",28,"Trochee","4"
"6","P_1002","Per_4","A_11","К женщине-поэту","","Я слушал вас… я прочитал","C. 177","per",12,"Iamb","4"
"7","P_1003","Per_4","A_163","Мотылек","","Горит и красуется пышное лето","C. 178-179","per",44,"Other","?"
"8","P_1004","Per_4","A_41","Картина востока","","В пустыне виден людный град","C. 180-181","per",25,"Iamb","4"
"9","P_1005","Per_4","A_139","Старость","","Нет, это не старик, кто жизнь свою годами","C. 182-183","per",31,"Iamb","6"
"10","P_1006","Per_4","A_154","Итальянская villa","","И распростясь с тревогою житейской","C. 184-185","per",28,"Iamb","5"
"11","P_1007","Per_4","A_192","Государю Наследнику на приезд Его Императорского Высочества в Полтаву во время выставки 1837 года 10 Октября","","Надежда будущих времен","C. 186-190","per",100,"Iamb","4"
"12","P_1008","Per_5","A_153","На памятник Сусанину","","Тебе ль чугун, тебе ли мрамор ставить","C. 179","per",16,"Iamb","v"
"13","P_1009","Per_5","A_161","На могиле Лели","","И вот ее прекрасное чело","C. 180","per",17,"Iamb","v"
"14","P_101","Per_3","A_113","Витязь","","Скажи мне, витязь, что твой лик","C. 12-14","per",60,"Iamb","4"
"15","P_1010","Per_5","A_154","Смотри, как запад разгорелся","","Смотри, как запад разгорелся","C. 181","per",8,"Iamb","4"
"16","P_1011","Per_5","","Освободительница","","Я в Мае утром рано встала","C. 182-184","per",56,"Iamb","4"
"17","P_1012","Per_5","A_191","Кольцо","Николаю Андреевичу Зарудному","В отдаленности глубокой","C. 187-191","per",114,"Trochee","4"
"18","P_1013","Per_5","A_50","Два мгновения","","Есть два блаженные мгновенья","C. 192-193","per",22,"Iamb","4"
"19","P_1014","Per_5","A_11","Опричник","Отрывок","Какая ночь! мороз трескучий","C. 194-195","per",35,"Iamb","4"
"20","P_1015","Per_5","A_7","Великое слово","Дума. Василию Андреевичу Жуковскому","Глубокая вечность","C. 196-198","per",58,"Amphibrach","2"
"21","P_1016","Per_6","A_153","К равнодушной","","Скажи, красавица жестокая моя","C. 76-78","per",67,"Iamb","6"
"22","P_1017","Per_6","A_242","Сонет Мильтона","","Когда придет мне в мысль, что я лишен очей","C. 79","per",14,"Iamb","6"
"23","P_1018","Per_6","A_170","К Венере Медицейской","","Богиня красоты, любви и наслажденья","C. 82-84","per",66,"Iamb","663"
"24","P_1019","Per_6","A_221","Друг, оседлай","","Друг! оседлай могучего орла","C. 85","per",15,"Iamb","v"
"25","P_102","Per_3","A_231","Бессмертие","","Чего всю жизнь достигнуть тщитесь","C. 14-16","per",64,"Iamb","4"
"26","P_1020","Per_6","A_50","За днями дни текут","","За днями дни текут обычной чередою","C. 86","per",8,"Iamb","6"
"27","P_1021","Per_6","","Алупка","","Девы! Севера родного","C. 87-88","per",24,"Trochee","4"
"28","P_1022","Per_6","A_242","К женщине","","Когда ты, женщина, предавшись обольщенью","C. 89","per",8,"Iamb","6"
"29","P_1023","Per_6","A_4","Надгробие младенцу","","Матери, общей нам всем, поручаю твой прах, мой младенец","C. 90","per",4,"Other","?"
"30","P_1024","Per_6","A_154","Арфа Скальда","","О, арфа Скальда! долго ты спала","C. 91","per",12,"Iamb","5"
"31","P_1025","Per_6","A_7","К милой","","Давно расстались мы с тобою","C. 92-93","per",28,"Iamb","4"
"32","P_1026","Per_7","A_166","Воскресное утро","Перевод из Францена","Какая всюду тишина","C. 18-20","per",60,"Iamb","4"
"33","P_1027","Per_7","A_166","","Перевод из Тегнера","Он скитался вокруг по пустынным морям","C. 27-29","per",48,"Anapest","other"
"34","P_1028","Per_7","A_166","Жалоба девы","Перевод из Рунеберга","Сердце! сердце! если б ты, тревожное","C. 44","per",12,"Trochee","v"
"35","P_1029","Per_7","A_166","Времена года в сердце девушки","Перевод из Рунеберга","Зимним утром вышла девица","C. 45","per",15,"Trochee","4"
"36","P_103","Per_3","A_143","Послание к другу","","Мой друг! куда, в какие воды","C. 155-160","per",183,"Iamb","4"
"37","P_1030","Per_7","A_166","Диво-птица","Перевод из Рунеберга","В хату сын пришел из поля на ночь","C. 45-48","per",84,"Trochee","5"
"38","P_1031","Per_7","A_166","Пленники","Перевод из Рунеберга","Как со дна реки, с песчаного","C. 49-50","per",32,"Other","?"
"39","P_1032","Per_8","A_151","Песнь русского","","Святую Русь и Белого Царя","C. 165","per",12,"Iamb","54"
"40","P_1033","Per_8","A_154","Весна","","Как ни гнетет рука судьбины","C. 169-170","per",40,"Iamb","4"
"41","P_1034","Per_8","A_51","Люблю","","Люблю я пламенные очи","C. 171-172","per",20,"Iamb","4"
"42","P_1035","Per_8","A_50","Девице-поэту","","Восторгов чистых, дум прекрасных","C. 173-174","per",36,"Iamb","4"
"43","P_1036","Per_8","A_4","Марии Д***с","","Дарами благими всещедрой рукою","C. 175","per",8,"Amphibrach","4"
"44","P_1037","Per_8","A_11","Путешенственнику","","Судьба на руль уже склонилась","C. 176","per",14,"Iamb","4"
"45","P_1038","Per_8","A_229","Сонет","","С тоской и полный грустных размышлений","C. 177","per",14,"Iamb","5"
"46","P_1039","Per_8","A_257","И как светло","","И как светло, и как прекрасно","C. 178-179","per",20,"Iamb","4"
"47","P_104","Per_3","A_220","Минувшая юность","Из Виктора Гюго","Воспоминанием отрадно вдохновенный","C. 160-161","per",26,"Iamb","v"
"48","P_1040","Per_8","A_77","Редкие мгновения","","Минуты есть: в душе благоговенье","C. 180","per",16,"Iamb","5"
"49","P_1041","Per_8","A_161","Вал","","Кипучий вал, тревожный вал","C. 181-182","per",44,"Iamb","4"
"50","P_1042","Per_9","A_163","Богдан","Отрывок из поэмы","Ночь. Вся окрестность тихо спит","C. 137-141","per",99,"Iamb","4"
"51","P_1043","Per_9","A_153","Отрывок из поэмы","","Как тяжело, как грустно сиротство","C. 142-144","per",64,"Iamb","v"
"52","P_1044","Per_9","A_154","День и ночь","","На мир таинственный духов","C. 145","per",16,"Iamb","4"
"53","P_1045","Per_9","A_161","Красная","","Пойдем-ка, брат - ведь ты знаток","C. 146-147","per",29,"Iamb","4"
"54","P_1046","Per_9","A_51","М.П. Бибикову","","Ты счастлив, друг! В страну очарованья","C. 148-149","per",44,"Iamb","v"
"55","P_1047","Per_9","A_153","Сосновый лес","","Весенних дней цветущее убранство","C. 150-151","per",24,"Iamb","5"
"56","P_1048","Per_9","","Ночь","","Ночь. Кругом все грозно было","C. 152-153","per",33,"Trochee","4"
"57","P_1049","Per_9","A_154","Не верь, не верь поэту","","Не верь, не верь поэту, дева","C. 154-155","per",20,"Iamb","4"
"58","P_105","Per_3","A_18","Возвратись!","","В поход мы рядились: все прихоти - в пламень","C. 161-163","per",80,"Amphibrach","4"
"59","P_1050","Per_9","","Гробница","","В долине безмолвной, где говор людской","C. 156-157","per",20,"Amphibrach","4"
"60","P_1051","Per_9","A_161","Последний его современник","","Слышишь, дядюшка, а? Дядька","C. 158","per",12,"Trochee","4"
"61","P_1052","Per_9","A_7","Бегство","","Уж как гляну я на поле","C. 159-161","per",44,"Trochee","4"
"62","P_1053","Per_9","A_153","","Две встречи","Я помню: на гульбище шумном","C. 162-163","per",45,"Iamb","4"
"63","P_1054","Per_9","A_153","","Две встречи","Я помню, я помню другое свиданье","C. 164-165","per",44,"Amphibrach","4"
"64","P_1055","Per_9","A_242","Посредница","","Из праха созданное тело","C. 166-167","per",16,"Iamb","4"
"65","P_1056","Per_9","A_257","Сон Ломоносова","","Корабль на парусах летит","C. 168-171","per",85,"Iamb","4"
"66","P_1057","Per_9","","Я видел море","","Я видел море: предо мною","C. 172-174","per",65,"Iamb","4"
"67","P_1058","Per_10","A_153","Черновая книга Пушкина","Василию Андреевичу Жуковскому","Смотрю с волнением, с тоскою умиленной","C. 137-138","per",34,"Iamb","6"
"68","P_1059","Per_10","A_154","Лебедь","","Пускай орел за облаками","C. 139","per",12,"Iamb","4"
"69","P_106","Per_3","A_15","Просьба","","Подари мне, мой час","C. 164","per",16,"Anapest","2"
"70","P_1060","Per_10","A_51","Остров","Е<?>.А. Баратынскому","Есть дикая скала в пустыне океана","C. 140-142","per",62,"Other","?"
"71","P_1061","Per_10","A_153","Сочувствия","Графине Софье Александровне Бобринской","Встречаются на жизненной дороге","C. 143-145","per",42,"Iamb","6"
"72","P_1062","Per_10","A_257","Беспокойство","","Зачем, на лоне тишины","C. 146-147","per",36,"Iamb","4"
"73","P_1063","Per_10","A_160","Кончина юноши-жениха","С греческого","Между гименом и могилой","C. 148","per",16,"Iamb","4"
"74","P_1064","Per_10","A_63","Рассвет","","Тихо к тучам прикоснулась","C. 149-150","per",44,"Trochee","4"
"75","P_1065","Per_10","A_165","В жизни темной","Из Гейне","В жизни темной и унылой","C. 151","per",12,"Trochee","4"
"76","P_1066","Per_10","A_153","Воспоминание о милой женщине Александре Осиповне Смирновой","","Нет, вы не знаете ее","C. 152-154","per",53,"Iamb","4"
"77","P_1067","Per_10","A_101","Покровителю","В.П.П.","В свои небесные скрижали","C. 155-156","per",53,"Iamb","4"
"78","P_1068","Per_10","A_2","","Антологические стихотворения","Благословен святое возвестивший","C. 157","per",10,"Iamb","5"
"79","P_1069","Per_10","A_2","","Антологические стихотворения","Были бури, непогоды","C. 158","per",12,"Trochee","4"
"80","P_107","Per_3","A_221","Червоный колпак","Белорусская баллада","Чи-чи-чи! кричит сорока","C. 164-168","per",133,"Trochee","4"
"81","P_1070","Per_10","A_2","","Антологические стихотворения","Еще как патриарх не древен я. Моей","C. 158","per",8,"Iamb","6"
"82","P_1071","Per_11","A_127","Его Императорскому Высочеству Герцогу Максимилиану Лейхтенбергскому принцу Эйхштедтскому","","Как весело, в лучах Монаршего венца","C. 214-215","per",28,"Iamb","v"
"83","P_1072","Per_11","A_19","Сельское кладбище","Греева элегия","Колокол поздний кончину отшедшего дня возвещает","C. 217-225","per",120,"Anapest","other"
"84","P_1073","Per_12","A_166","Вечер на рождество","Из Рунеберга, с шведского","Над степью бледный месяц плыл","C. 28-31","per",85,"Iamb","4"
"85","P_1074","Per_13","A_19","Молитвой нашей Бог смягчился","","С полудороги прилетел ты","C. 112-114","per",48,"Iamb","4"
"86","P_1075","Per_13","","К Александровской колонне","","О памятник годины славной","C. 115-116","per",40,"Iamb","4"
"87","P_1076","Per_13","A_221","Прошедший год","","Чуть помня о мечте своей","C. 117-122","per",117,"Iamb","4"
"88","P_1077","Per_13","A_153","Нардзан","","О нет! не сравнивайте с ним","C. 123-124","per",44,"Iamb","4"
"89","P_1078","Per_13","A_161","Ты в мир земной пришла","","Ты в мир земной пришла ошибкой","C. 125","per",16,"Iamb","v"
"90","P_1079","Per_13","A_208","На смерть девушки","","Закрылись прекрасные очи","C. 129-130","per",24,"Amphibrach","3"
"91","P_108","Per_3","A_113","Тайна","Баллада","В лесу, прибит на дубе вековом","C. 169-170","per",44,"Iamb","5"
"92","P_1080","Per_13","A_161","Могила","","И право лучше там, в жилище мертвецов","C. 131","per",15,"Iamb","v"
"93","P_1081","Per_13","A_101","Решимость","","Я покинула желанья","C. 132-133","per",28,"Trochee","4"
"94","P_1082","Per_13","A_153","Колокольный звон ночью","","Он томно загудел, торжественный, нежданный","C. 134-135","per",32,"Iamb","63"
"95","P_1083","Per_13","A_161","Слезы","","Я так счастлив, великий Боже","C. 136","per",12,"Iamb","4"
"96","P_1084","Per_13","A_77","Был год","","Был год, год мести роковой","C. 137-139","per",52,"Iamb","v"
"97","P_1085","Per_13","","Простонародный рассказ","","Жил да был на земле","C. 140-142","per",85,"Other","?"
"98","P_1086","Per_14","A_153","Хранитель-крест","","Мой крест, хранитель мой! с молитвой, с упованьем","C. 247-248","per",24,"Iamb","6"
"99","P_1087","Per_14","A_257","Колокол в Кремле","","В короткий, мгновенный период свиданья","C. 249-252","per",79,"Amphibrach","4"
"100","P_1088","Per_14","A_2","","Антологические стихотворения","Тщетно, меж бурною жизнью и хладною смертью, философ","C. 253","per",8,"Dactyl","5"
"101","P_1089","Per_14","","А.М.С.","Антологические стихотворения","Она была сирот отрада","C. 253","per",4,"Iamb","4"
"102","P_109","Per_15","A_15","Вдали и вблизи","","Утро.. полдень.. вечереет","C. 1-3","per",80,"Trochee","4"
"103","P_1090","Per_14","A_2","","Антологические стихотворения","Все мысль да мысль!… художник бедный слова","C. 254","per",9,"Other","?"
"104","P_1091","Per_14","A_166","На гробницу младенца","Антологические стихотворения","Здесь ангел спит. На жизнь земную","C. 254","per",5,"Other","?"
"105","P_1092","Per_16","A_139","Граф Конрад и его жена","Баллада","Рыцарь! солнце взошло","C. 164-173","per",210,"Anapest","other"
"106","P_1093","Per_16","A_257","Художник","Оль-Буль","По теплой страсти иль от скуки","C. 174-182","per",232,"Iamb","4"
"107","P_1094","Per_16","A_101","Женщина и бал","","Мне скучны бальные веселья","C. 183-186","per",62,"Iamb","v"
"108","P_1095","Per_16","A_154","Осенний вечер","","Есть в светлости осенних вечеров","C. 187","per",12,"Iamb","5"
"109","P_1096","Per_16","A_153","Как жаль ее","","Ее не стало!… Замолчите","C. 188-190","per",52,"Iamb","4"
"110","P_1097","Per_17","","","","Сыны племен, когда-то враждовавших","C. 17-19","per",64,"Iamb","5"
"111","P_1098","Per_17","A_19","Чувства пред гробом Государыни Императрицы Марии Феодоровны, в ночи, накануне ее погребения","","И так Твой гроб с мольбой объемлю","C. 89-93","per",101,"Iamb","4"
"112","P_1099","Per_18","A_153","Первый соловей","","Так это правда? и весна","C. 291-292","per",28,"Iamb","4"
"113","P_11","Per_2","A_138","Аполог","","Нас всегда мечта напрасно","C. 22","per",28,"Trochee","4"
"114","P_110","Per_15","A_18","К Алине","","Алина, вижу, ты прекрасна","C. 191-192","per",39,"Iamb","4"
"115","P_1100","Per_18","A_232","Бредина и волны","Дума. П.А. Плетневу","В тот миг, когда море бушует, бурлит","C. 293-294","per",42,"Other","?"
"116","P_1101","Per_18","A_161","Посвящено Е-е А-е К-ой","","Она не дева красоты","C. 295-296","per",20,"Iamb","4"
"117","P_1102","Per_18","A_101","Мечтатель","","Разочарованный, угрюмый","C. 297-298","per",29,"Iamb","4"
"118","P_1103","Per_18","A_154","С какою негою","","С какою негою, с какой тоской влюбленной","C. 299","per",16,"Iamb","6664"
"119","P_1104","Per_18","A_153","В Москву!","","В Москву! В Москву!… в тот город столь знакомый","C. 300-301","per",40,"Iamb","5"
"120","P_1105","Per_18","A_161","Совет","","Счастливое, беспечное дитя","C. 302","per",26,"Iamb","v"
"121","P_1106","Per_19","A_153","Песни Трувера","","Певец мой, приближься; святых вдохновений","C. 1-4","per",106,"Other","?"
"122","P_1107","Per_20","A_165","Саламанка","Из Гейне","На бульварах Саламанки","C. 74","per",32,"Trochee","4"
"123","P_111","Per_15","","Упрек","Из греческой антологии","Время быстро летит","C. 192-193","per",20,"Anapest","2"
"124","P_1110","Per_20","A_114","Еврейская мелодия","Из Байрона","Душа моя мрачна. Скорей, певец, скорей","C. 80","per",16,"Iamb","v"
"125","P_1111","Per_20","A_114","В альбом","Из Байрона","Как одинокая гробница","C. 81","per",9,"Iamb","4"
"126","P_1112","Per_20","A_7","Путь","","Путь широкий давно","C. 81-82","per",32,"Anapest","2"
"127","P_1115","Per_20","A_169","Лорелея","С немецкого, из Гейне","И горюя, и тоскуя","C. 141-142","per",24,"Trochee","4"
"128","P_1116","Per_20","A_169","Литовская песня","","Землю как гонец","C. 142-143","per",36,"Other","?"
"129","P_112","Per_15","A_113","Русская певица","","Когда ты нежностью своей","C. 193-194","per",43,"Iamb","4"
"130","P_1120","Per_20","A_160","Вазантазена","","Остановись, Вазантазена","C. 209-210","per",32,"Iamb","4"
"131","P_1122","Per_21","A_226","Отрывок из первого действия первой части Фауста","","О, счастлив тот, кто верует мечтам","C. 1-2","per",36,"Iamb","v"
"132","P_1123","Per_21","A_161","","Два вопроса","Скажите мне, где лоно рая","C. 165-166","per",39,"Iamb","4"
"133","P_1124","Per_21","A_161","","Два вопроса","Скажи мне, мир земной, скиталец","C. 166-167","per",35,"Iamb","4"
"134","P_1125","Per_21","A_114","Три пальмы","Восточное сказание","В песчаных степях аравийской земли","C. 168-170","per",60,"Amphibrach","4"
"135","P_1126","Per_21","A_160","Вороной конь","Новогреческая песнь","На утесе крутом я в раздумьи моем","C. 251-253","per",80,"Anapest","other"
"136","P_1127","Per_21","A_169","Военная песнь клана Макгрегор","Из Вальтера Скотта, с английского. Macgregor’s Gathering","Луна над рекой и туманы кругом","C. 254-255","per",30,"Amphibrach","4"
"137","P_1128","Per_21","","Утренний звон","","Они звучат - торжественные звуки -","C. 255-256","per",28,"Iamb","5"
"138","P_113","Per_15","A_113","Дуб","","Краса родной горы, с тенистыми ветвями","C. 194-195","per",44,"Iamb","6"
"139","P_1130","Per_21","A_163","Украинская мелодия","","","C. ","per",15,"Trochee","4"
"140","P_1131","Per_22","A_169","Сонет","","Не дай ты потускнеть душе зеркально-чистой","C. 43","per",14,"Iamb","6"
"141","P_1132","Per_22","A_169","Яша","Из Вальтера Скотта. С английского","Что плачешь ты, краса моя","C. 43-44","per",32,"Iamb","43"
"142","P_1133","Per_22","A_157","Элегия","Из В. Гюго","В вечерний час, когда с тобой","C. 82-85","per",119,"Iamb","v"
"143","P_1134","Per_22","A_187","* * *","","Гордись! тебе льстецы сказали","C. 143-144","per",68,"Iamb","4"
"144","P_1135","Per_22","A_113","Графине Лаваль","В день ее рождения","Полночная редеет тень","C. 119","per",20,"Iamb","4"
"145","P_1136","Per_22","A_169","Эдвард","Старинная шотландская баллада","Как грустно ты главу склонил, Эдвард! Эдвард","C. 159-161","per",56,"Other","?"
"146","P_1137","Per_22","A_236","К Н. Н…ву","","Люблю внимать тебе порою","C. 208","per",20,"Iamb","4"
"147","P_1138","Per_22","A_169","* * *","","Шепот грустный, говор тайной","C. 209","per",24,"Trochee","4"
"148","P_1139","Per_22","A_165","Ратклиф","Из Гейне","Бог сна привел меня в далекий край","C. 210-213","per",142,"Iamb","5"
"149","P_114","Per_15","","Обитатель Сиона","Подражание псалму","О Господи, кто обитает","C. 196","per",24,"Iamb","4"
"150","P_1140","Per_22","A_114","Молитва","","В минуту жизни трудную","C. 272","per",12,"Iamb","3"
"151","P_1141","Per_23","A_114","Дары Терека","","Терек воет, дик и злобен","C. 1-3","per",76,"Trochee","4"
"152","P_1142","Per_23","A_150","Брайтон","","Сошел на Брайтон мир глубокий","C. 3-4","per",20,"Iamb","4"
"153","P_1143","Per_23","A_169","Розабелла","С английского, из Вальтера Скотта","Не расскажу вам, красотам","C. 131-133","per",52,"Iamb","4"
"154","P_1144","Per_23","A_152","Молитва","","Хвала тебе, Творец, хвала, благодаренье","C. 133","per",16,"Iamb","v"
"155","P_1145","Per_23","A_208","Весна","","Весна! опять в душе неясный идеал","C. 134","per",20,"Iamb","6"
"156","P_1146","Per_23","A_163","Гетман Свирговский","","Господарь Иоанн","C. 176-178","per",78,"Anapest","other"
"157","P_1147","Per_23","A_114","Памяти А.И. Од-го","","Я знал его; мы странствовали с ним","C. 210-211","per",65,"Iamb","5"
"158","P_1148","Per_24","A_11","А.Д. Б…ской","","Когда-то, помню, с умиленьем","C. 1","per",9,"Iamb","4"
"159","P_1151","Per_24","A_7","Хуторок","","За рекой, на горе","C. 82-84","per",92,"Anapest","2"
"160","P_1152","Per_24","A_208","Песнь инвалида","","Был у нас в былые годы","C. 84-85","per",44,"Trochee","4"
