"","text_id","source_id","A_ID","text_title","text_subtitle","first_line","text_page","corpus","n_lines","meter","feet"
"3446","C_315__2","C_315","A_114","Узник","","Отворите мне темницу, ","C. 39-41","col",24,"Trochee","4"
"3447","C_315__2","C_315","A_114","Узник","","Отворите мне темницу, ","C. 39-41","col",24,"Trochee","4"
"3448","C_315__3","C_315","A_114","Молитва","","Я, Матерь Божия, ныне с молитвою ","C. 43-44","col",16,"Dactyl","4"
"3449","C_315__4","C_315","A_114","Дума","","Печально я гляжу на наше поколенье! ","C. 45-48","col",44,"Iamb","v"
"3450","C_315__5","C_315","A_114","Русалка","","Русалка плыла по реке голубой, ","C. 49-51","col",28,"Anapest","other"
"3451","C_315__6","C_315","A_114","Ветка Палестины","","Скажи мне, ветка Палестины: ","C. 53-55","col",36,"Iamb","4"
"3452","C_315__7","C_315","A_114","Не верь себе","","Не верь, не верь себе, мечтатель молодой, ","C. 57-60","col",40,"Iamb","64"
"3453","C_315__8","C_315","A_114","Еврейская мелодия ","Из Байрона","Душа моя мрачна. Скорей, певец, скорей! ","C. 61-62","col",16,"Iamb","64"
"3454","C_315__9","C_315","A_114","В альбом ","Из Байрона","Как одинокая гробница ","C. 63-64","col",9,"Iamb","4"
"3455","C_315__10","C_315","A_114","Три пальмы ","Восточное сказание","В песчаных степях аравийской земли ","C. 65-70","col",60,"Amphibrach","4"
"3456","C_315__11","C_315","A_114","Молитва","","В минуту жизни трудную ","C. 71-72","col",12,"Iamb","3"
"3457","C_315__12","C_315","A_114","Дары Терека","","Терек воет, дик и злобен, ","C. 73-77","col",76,"Trochee","4"
"3458","C_315__13","C_315","A_114","Памяти А.И. О-го","","Я знал его: мы странствовали с ним ","C. 79-84","col",65,"Iamb","5"
"3459","C_315__14","C_315","A_114","1-е января","","Как часто, пестрою толпою окружен, ","C. 85-88","col",42,"Iamb","664"
"3460","C_315__15","C_315","A_114","Казачья колыбельная песня","","Спи, младенец мой прекрасный, ","C. 89-92","col",48,"Trochee","43"
"3461","C_315__16","C_315","A_114","Журналист, читатель и писатель","","Я очень рад, что вы больны: 
","C. 93-102","col",165,"Iamb","4"
"3462","C_315__17","C_315","A_114","Воздушный корабль ","Из Зейдлица","По синим волнам океана, ","C. 103-107","col",72,"Amphibrach","3"
"3463","C_315__18","C_315","A_114","И скучно, и грустно","","И скучно и грустно, и некому руку подать ","C. 109-110","col",12,"Amphibrach","5354"
"3464","C_315__19","C_315","A_114","Ребенку","","О грезах юности томим воспоминаньем, ","C. 111-114","col",32,"Iamb","6"
"3465","C_315__20","C_315","A_114","Отчего","","Мне грустно, потому что я тебя люблю, ","C. 115-116","col",6,"Iamb","6"
"3466","C_315__21","C_315","A_114","Благодарность","","За всё, за всё тебя благодарю я: ","C. 117-118","col",8,"Iamb","5"
"3467","C_315__22","C_315","A_114","Из Гете","","Горные вершины ","C. 119-120","col",8,"Other","?"
"3468","C_315__23","C_315","A_114","NA ","","Когда волнуется желтеющая нива ","C. 161-162","col",16,"Iamb","v"
"3469","C_315__24","C_315","A_114","Сосед","","Кто б ни был ты, печальный мой сосед, ","C. 163-164","col",24,"Iamb","554"
"3470","C_315__25","C_315","A_114","NA ","","Расстались мы; но твой портрет ","C. 165","col",8,"Iamb","4"
"3471","C_315__26","C_315","A_114","Тучи","","Тучки небесные, вечные странники! ","C. 167-168","col",12,"Dactyl","4"
"3472","C_316__1","C_316","A_115","Колизей","","Поросшие мхом, окаймленные плющем,","C. 1-5","col",104,"Amphibrach","4"
"3473","C_316__2","C_316","A_115","Ангел смерти","","Придет пора преображенья,","C. 6-7","col",32,"Iamb","4"
"3474","C_316__3","C_316","A_115","Встреча душ. I","","Всё туманится и тмится,","C. 7-9","col",44,"Trochee","4"
"3475","C_316__4","C_316","A_115","Встреча душ. II","","Слышно тихое жужжанье","C. 9-12","col",48,"Trochee","4"
"3476","C_316__5","C_316","A_115","Встреча душ. III","","И в блаженстве беззаветном","C. 12","col",16,"Trochee","4"
"3477","C_316__6","C_316","A_115","Истинная мудрость","","Не всё постигнул ум надменный,","C. 13-17","col",92,"Iamb","4"
"3478","C_316__7","C_316","A_115","Земляку","","Бывали дни, ― в стране родной","C. 17-21","col",86,"Iamb","4"
"3479","C_316__8","C_316","A_115","Мысль","","Спит дряхлый мир, спит старец обветшалый,","C. 21-22","col",28,"Iamb","v"
"3480","C_316__9","C_316","A_115","Поэзия","","Я владею чудным даром,","C. 23-24","col",32,"Trochee","4"
"3481","C_316__10","C_316","A_115","Горы","","Передо мной Кавказ суровый,","C. 24-27","col",60,"Iamb","4"
"3482","C_316__11","C_316","A_115","Моя судьба","","Мне плакать хочется, а плакать в мире стыдно,","C. 27-28","col",28,"Iamb","64"
"3483","C_316__12","C_316","A_115","Злой дух","","Дух нечистый, дух порочный,","C. 29-30","col",41,"Trochee","4"
"3484","C_316__13","C_316","A_115","Незабвенная","","О память, память! образ нежный","C. 31-33","col",45,"Iamb","4"
"3485","C_316__14","C_316","A_115","Два мгновенья","","Печальный свет лампады озаряет","C. 33-35","col",37,"Iamb","v"
"3486","C_316__15","C_316","A_115","Турчанка","","Гюльнара, гурия младая!","C. 35-38","col",61,"Other","?"
"3487","C_316__16","C_316","A_115","Сомнение","","Ты начал жить. Роскошен жизни пир,","C. 38-42","col",83,"Iamb","5"
"3488","C_316__17","C_316","A_115","Песня","","Мало на долю мою бесталанную","C. 42-43","col",28,"Dactyl","43"
"3489","C_316__18","C_316","A_115","Покойница","","""Кто умер здесь? какой потери","C. 43-45","col",35,"Iamb","4"
"3490","C_316__19","C_316","A_115","Ворон ","Баллада","Не шум домовых на полночном пиру,","C. 53-58","col",90,"Amphibrach","4343434344"
"3491","C_316__20","C_316","A_115","Рыцарь ","Баллада","Не жалобной чайки могильные крики,","C. 58-60","col",56,"Amphibrach","4"
"3492","C_316__21","C_316","A_115","Водяной ","Баллада","""Меня из - под солнца сманил Водяной","C. 61-63","col",50,"Amphibrach","4343434344"
"3493","C_316__22","C_316","A_115","Пир ведьмы","","Тёмно в хате, душно в хате;
","C. 63-65","col",48,"Trochee","4"
"3494","C_316__23","C_316","A_115","Непонятная песня","","Клокочет, бушует, волнуется море","C. 66-68","col",44,"Amphibrach","4"
"3495","C_316__24","C_316","A_115","Человек","","Когда сверкнет звезда полночи","C. 68-69","col",16,"Iamb","4"
"3496","C_316__25","C_316","A_115","Изгнанник","","Еще младенцу в колыбели","C. 69-74","col",107,"Iamb","4"
"3497","C_316__26","C_316","A_115","Жизнь","","Прекрасно, высоко твое предназначенье,","C. 74-76","col",46,"Iamb","6"
"3498","C_316__27","C_316","A_115","Незавенный вечер","","Как быстро, быстро промелькнул","C. 76-80","col",78,"Iamb","4"
"3499","C_316__28","C_316","A_115","Безнадежность","","Жизнь без надежд ― тропа без цели,","C. 80-81","col",28,"Iamb","4"
"3500","C_316__29","C_316","A_115","Могила брата","","Я был на могиле, похитившей брата,","C. 81-84","col",48,"Amphibrach","4"
"3501","C_316__30","C_316","A_115","Смерти","","Не приходи в часы волнений,","C. 84-85","col",37,"Iamb","4"
"3502","C_316__31","C_316","A_115","Вчера, сегодня ","Сонет","Вчера я бесстрашно сидел под грозою","C. 86","col",14,"Amphibrach","4"
"3503","C_316__32","C_316","A_115","Ночь","","Я не сплю, не сплю ― не спится,
","C. 86-89","col",54,"Trochee","4"
"3504","C_316__33","C_316","A_115","Дни благословенные","","Дни благословенные, дни многоотрадные","C. 89-90","col",20,"Trochee","84"
"3505","C_316__34","C_316","A_115","Загадка ","Снет ","Непостижною святынею","C. 90-91","col",14,"Trochee","4"
"3506","C_316__35","C_316","A_115","Рукоять ","Сонет","Не рылся я в земле в надежде вырыть злато,","C. 91-92","col",14,"Iamb","6"
"3507","C_316__36","C_316","A_115","Обет","","О, покинь меня! напрасно","C. 92-93","col",24,"Trochee","4"
"3508","C_316__37","C_316","A_115","Красавице","","Красавица! не пой веселых песен мне!","C. 93-95","col",49,"Iamb","v"
"3509","C_316__38","C_316","A_115","Тот не поэт","","Кто духом слаб и немощен душою,","C. 96-97","col",30,"Iamb","5"
"3510","C_316__39","C_316","A_115","Песня Замы","","Силен и строен мой милый, нет равного","C. 97-99","col",40,"Dactyl","43"
"3511","C_316__40","C_316","A_115","Час молитвы","","Когда взойдет денница золотая","C. 99-101","col",32,"Iamb","52"
"3512","C_316__41","C_316","A_115","Смуглянке","","Черны, черны тени ночи,","C. 101-103","col",45,"Trochee","4"
"3513","C_316__42","C_316","A_115","Весна","","Волна катится за волною","C. 103-106","col",56,"Iamb","4"
"3514","C_316__43","C_316","A_115","Сердцу","","Она так нежно, так заботно","C. 106-108","col",40,"Iamb","4"
"3515","C_316__44","C_316","A_115","Признание","","Я пленен, я очарован,","C. 108-109","col",28,"Trochee","4"
"3516","C_316__45","C_316","A_115","Разговор","","Что ты, душа, так ноешь, страждешь,
","C. 109-116","col",131,"Iamb","4"
"3517","C_318__1","C_318","A_116","Развалины древнего замка","","Уныло с тверди голубой","C. 1-24","col",402,"Iamb","4"
"3518","C_318__2","C_318","A_116","Цветы ","Баллада из простонародного рассказа","Небывалая вина!","C. 27-49","col",386,"Trochee","4"
"3519","C_318__3","C_318","A_116","Едвин","","Что в мире может быть живее","C. 53-63","col",166,"Iamb","4"
"3520","C_318__4","C_318","A_116","Задумчивая","","Как сладостно из - под чела,","C. 67-73","col",98,"Iamb","4"
"3521","C_318__5","C_318","A_116","К Е... К...","","О слыхала - ль гимн великий","C. 77-80","col",48,"Trochee","4"
"3522","C_319__1","C_319","A_117","Молебствие за победы на Царицыном лугу. 1830 года","","День светлый, солнце золотое","C. 3-7","col",73,"Iamb","4"
"3523","C_319__2","C_319","A_117","На 2 июля 1839 года","","Слава Творцу Всеблагому,","C. 8-12","col",48,"Anapest","other"
"3524","C_319__3","C_319","A_117","Благодетельнице моего семейства Княгине Татьяне Васильевне Юсуповой, на приезд ее в Рыбацкую июля 28 дня 1838 года","","Радостино солнца для нас появленье,","C. 13-15","col",20,"Dactyl","43"
"3525","C_319__4","C_319","A_117","Счастливый внук","","Близ бытрой Котросли реки,","C. 16-24","col",145,"Iamb","4"
"3526","C_319__5","C_319","A_117","Парфен Порядовщик","","Пришла весна - и ручейки","C. 25-43","col",296,"Iamb","4"
"3527","C_319__6","C_319","A_117","Софрон Удальцов","","Софрон Гульяныч Удальцов,","C. 44-48","col",73,"Iamb","4"
"3528","C_319__7","C_319","A_117","Раскладка оброка","","С концом работы полевые,","C. 49-56","col",117,"Iamb","4"
"3529","C_319__8","C_319","A_117","Беседа поселян","","Во время летнего досуга","C. 57-65","col",131,"Iamb","4"
"3530","C_319__9","C_319","A_117","Кирпичники","","С восходом солнца по дороге,","C. 66-69","col",56,"Iamb","4"
"3531","C_319__10","C_319","A_117","Волынка","","Лежала скромно у окна,","C. 70-72","col",29,"Iamb","4"
"3532","C_319__11","C_319","A_117","Время","","Дни молодые пролетели,","C. 73-74","col",20,"Iamb","4"
"3533","C_319__12","C_319","A_117","Старая быль","","За Днепром было, в славном Киеве,","C. 75-78","col",47,"Amphibrach","3"
"3534","C_319__13","C_319","A_117","39й год","","Весною к Невским берегам,","C. 79-84","col",80,"Iamb","4"
"3535","C_320__1","C_320","A_118",NA,"","Пуская в свет мои мечты,","C. NA","col",8,"Iamb","4"
"3536","C_320__2","C_320","A_118","Похищение из гарема ","Баллады","Кто в ночи при луне открывает окно?","C. NA","col",28,"Anapest","other"
"3537","C_320__3","C_320","A_118","Замок Рауфенбах ","Баллады","На гранит ступает твердо
","C. NA","col",76,"Trochee","4"
"3538","C_320__4","C_320","A_118","Удавленник","Баллады","Ужин сняли. Слава богу, ","C. NA","col",28,"Trochee","4"
"3539","C_320__5","C_320","A_118","Безумная","","Ах, не плачь и не тужи, ","C. ","col",54,"Trochee","443"
"3540","C_320__6","C_320","A_118","Две розы","","Вчера златокудрявый, ","C. ","col",50,"Iamb","3"
"3541","C_320__7","C_320","A_118","Серенада","","Плывет луна по высоте, ","C. ","col",24,"Iamb","4"
"3542","C_320__8","C_320","A_118","Мой сад","","В моем саду, в тени густых аллей, ","C. ","col",18,"Iamb","5"
"3543","C_320__9","C_320","A_118","Признание","","Простите мне невольное признанье! ","C. ","col",32,"Iamb","5"
"3544","C_320__10","C_320","A_118","Застольная песня","","Фиял кипит янтарной Ипокреной, ","C. ","col",33,"Iamb","5"
"3545","C_320__11","C_320","A_118","Кольцо","","Скажи, кольцо, как друг иль как злодей ","C. ","col",32,"Iamb","5"
"3546","C_320__12","C_320","A_118","Утешение","","Вспорхнул твой ветреник, уж нет его с тобою! ","C. ","col",12,"Iamb","6"
"3547","C_320__13","C_320","A_118","Странность","","В мире, где радостей нет, Эпикур говорит: наслаждайся! ","C. ","col",2,"Dactyl","6"
"3548","C_320__14","C_320","A_118","Откровенность","","Не силен жар ланит твоих младых ","C. ","col",32,"Iamb","5"
"3549","C_320__15","C_320","A_118","Одалиска","","Вот груди - жаркий пух, вот взоры - звезды ночи, ","C. ","col",5,"Iamb","v"
"3550","C_320__16","C_320","A_118","Ласточка","","Я люблю посмотреть, ","C. ","col",8,"Other","?"
"3551","C_320__17","C_320","A_118","В альбом","","Пусть гений прошлого с улыбкой ","C. ","col",8,"Iamb","4"
"3552","C_320__18","C_320","A_118","Вакхическая песня","","Побольше влаги светлой мне, ","C. ","col",20,"Iamb","43"
"3553","C_320__19","C_320","A_118","На смерть юной девы","","В обширном саду, испещренном живыми цветами, ","C. ","col",16,"Amphibrach","5"
"3554","C_320__20","C_320","A_118","Художник к деве","","Дева, не спрашивай ","C. ","col",38,"Other","?"
"3555","C_320__21","C_320","A_118","Вакханка","","Зачем как газель ","C. ","col",27,"Amphibrach","2"
"3556","C_320__22","C_320","A_118","Колодник","","С каждым шагом тяжкие оковы ","C. ","col",8,"Trochee","5"
"3557","C_320__23","C_320","A_118","Тоска по невозвратном","","Опять в душе минувшая тревога, ","C. ","col",8,"Iamb","5"
"3558","C_320__24","C_320","A_118","Невозвратное","","Друг, о чем ты всё тоскуешь? ","C. ","col",8,"Trochee","4"
"3559","C_320__25","C_320","A_118","Вздох","","Быть может, всё оставило поэта, - ","C. ","col",8,"Iamb","5"
"3560","C_320__26","C_320","A_118","К лешему","","На мшистом старом пне, скрестив кривые ноги ","C. ","col",8,"Iamb","6"
"3561","C_320__27","C_320","A_118","Хандра","","Когда на серый, мутный небосклон ","C. ","col",40,"Iamb","5"
"3562","C_320__28","C_320","A_118","Ночь и день","","Мила мне ночь, когда в неверной тьме ","C. ","col",9,"Iamb","v"
"3563","C_320__29","C_320","A_118","Эпитафия","","Любил он песням дев задумчиво внимать, ","C. ","col",5,"Iamb","v"
"3564","C_320__30","C_320","A_118","Арабеск","","Черную урну с прахом поэта ","C. ","col",12,"Dactyl","42"
"3565","C_320__31","C_320","A_118","Вечерний звон ","Памяти Козлова","Мечтанье было то иль сон? ","C. ","col",18,"Iamb","4"
"3566","C_320__32","C_320","A_118","Водопад","","Там, как сраженный ","C. ","col",36,"Iamb","2"
"3567","C_320__33","C_320","A_118","* * *","","Солнце потухло, плавает запах ","C. ","col",18,"Other","?"
"3568","C_320__34","C_320","A_118","* * *","","Ты мне простишь, мой друг, что каждый раз, ","C. ","col",16,"Iamb","v"
"3569","C_320__35","C_320","A_118","* * *","","Сними твою одежду дорогую, ","C. ","col",8,"Iamb","v"
"3570","C_320__36","C_320","A_118","* * *","","Не плачь, моя душа: ведь сердцу не легко ","C. ","col",15,"Iamb","6"
"3571","C_320__37","C_320","A_118","* * *","","Доволен я на дне моей души, ","C. ","col",4,"Iamb","5"
"3572","C_320__38","C_320","A_118","* * *","","Над морем спит косматый бор; ","C. ","col",12,"Iamb","43"
"3573","C_320__39","C_320","A_118","* * *","","На балконе золоченом ","C. ","col",12,"Trochee","4"
"3574","C_320__40","C_320","A_118","* * *","","Посмотри, наш боец зашатался, упал, ","C. ","col",12,"Anapest","other"
"3575","C_320__41","C_320","A_118","* * *","","Она легка, как тонкий пар ","C. ","col",10,"Iamb","3"
"3576","C_320__42","C_320","A_118","* * *","","Уж, серпы на плеча взложив, усталые жницы ","C. ","col",22,"Anapest","other"
"3577","C_320__43","C_320","A_118","* * *","","Стократ блажен, когда я мог стяжать ","C. ","col",16,"Iamb","5"
"3578","C_324__1","C_324","","Русскому дворянству","","Умолкни глас неправды в мире,","C. 3-9","col",92,"Iamb","4"
"3579","C_324__2","C_324","","Москве","","Первопрестольная столица,","C. 10-14","col",60,"Iamb","4"
"3580","C_324__3","C_324","","Победоносному российскому воинству","","Всесилен Россов брани Бог,
","C. 15-24","col",138,"Iamb","4"
"3581","C_325__1","C_325","A_11","В. С. Филимонову, при получении поэмы его: Дурацкий колпак","","Вам Музы, милые старушки,","C. 1-2","col",16,"Iamb","4"
"3582","C_325__2","C_325","A_18","Незнакомке ","В альбом","Давно альбом уподобляют храму,","C. 45-46","col",22,"Iamb","5"
"3583","C_325__3","C_325","A_250","Прошедшее","","""Зерцало доблестей и зол!","C. 47-48","col",37,"Iamb","v"
"3584","C_325__4","C_325","A_250","Роза и человек ","Вольный перевод из Кальдерона де ла Барка","—- ""Скажи, к чему, из почки нежной,","C. 92-93","col",22,"Iamb","4"
"3585","C_325__5","C_325","A_201","Рим-Москва","","Здесь та ж лазурь небес, здесь те же Аппенины,","C. 94-96","col",48,"Iamb","64"
"3586","C_325__6","C_325","","Череп","","Безмолвен ты, остаток разрушенья,","C. 97-99","col",53,"Other","?"
"3587","C_325__7","C_325","A_46","Бальный призрак","","Вальса резким, быстрым звуком","C. 138-139","col",32,"Trochee","4"
"3588","C_325__8","C_325","A_37","Русалка","","Близ гордого замка, по сонной реке,","C. 140-142","col",50,"Other","?"
"3589","C_325__9","C_325","","Подражания восточным поэтам. I","","Восток уж румянцем багровым","C. 143-144","col",16,"Amphibrach","4"
"3590","C_325__10","C_325","","Подражания восточным поэтам. II","","Благодарю, Аллах высокой!","C. 144","col",12,"Iamb","4"
"3591","C_325__11","C_325","A_201","Кладбище","","Я жизнь мою, я Иду встретил","C. 176","col",16,"Other","?"
"3592","C_325__12","C_325","A_277","Любовь","","Из праха вырос человек,
","C. 177-178","col",34,"Iamb","4"
"3593","C_325__13","C_325","A_62","Мысли Конфуция","","Лик времени тройствен: согбенному старцу подобно,","C. 179","col",14,"Amphibrach","5"
"3594","C_325__14","C_325","A_37","Признание","","Не утаю: ты предо мною","C. 196-197","col",34,"Iamb","4"
"3595","C_325__15","C_325","A_24","В.Н. Ш-ой","","Я вас не знал: но, в мире вдохновенья,","C. 198-199","col",29,"Iamb","v"
"3596","C_325__16","C_325","","Не пой!","","Не пой! чарующее пенье","C. 200","col",8,"Iamb","4"
"3597","C_325__17","C_325","","Ее уж нет...","","Ее уж неть! Сосуд страдальный","C. 201","col",12,"Iamb","4"
"3598","C_325__18","C_325","A_201","В альбом любезному К-у","","Пусть жизни летопись, альбом,","C. 202","col",4,"Iamb","4"
"3599","C_325__19","C_325","A_201","Песня","","Опять шумят Наровы волны,","C. 214-215","col",24,"Iamb","4"
"3600","C_325__20","C_325","A_24","Прелесть ночи ","Из Гете","Не пой про ночь, красавица, уныло","C. 216-217","col",36,"Iamb","5"
"3601","C_325__21","C_325","","М.Н. В...р","","От вас меня Господь спаси,","C. 218","col",5,"Iamb","4"
"3602","C_325__22","C_325","","Конь ","Фантазия","""О, дайте мне, дайте коня молодого,","C. 273-277","col",92,"Other","?"
"3603","C_325__23","C_325","A_24","Соловью","","Певец зари, любовник розы,","C. 278-279","col",25,"Iamb","4"
"3604","C_325__24","C_325","A_201","В альбом госпоже А*** А*** А***","","Понеже ваш альбом не весь еще исписан,","C. 280","col",8,"Iamb","6"
"3605","C_325__25","C_325","","Роза и репейник ","Басня","Между Репейником, в леску,","C. 281-282","col",20,"Iamb","v"
"3606","C_325__26","C_325","A_201","Германке","","........................","C. 303-304","col",23,"Iamb","4"
"3607","C_325__27","C_325","","Где?","","Как бы с жизнию опять,","C. 305","col",12,"Trochee","4"
"3608","C_325__28","C_325","","Обнова ","Басня","Между романами ""Рогнеда"" и ""Интрига"",","C. 306-307","col",26,"Iamb","v"
"3609","C_325__29","C_325","A_201","Н.Р. Б-у, при посылке ему поэмы Обед","","Я верен слову моему:","C. 308","col",8,"Iamb","4"
"3610","C_325__30","C_325","","Любимый цвет","","Я цвет алый любил:","C. 309-310","col",36,"Anapest","2"
"3611","C_325__31","C_325","","Сонет ","Из Петрарки","Прекрасше холмы, вам скорбный мой привет!","C. 320-321","col",14,"Iamb","6"
"3612","C_325__32","C_325","","Два состояния","","Как часто, мятежною думой томим,","C. 322-323","col",19,"Amphibrach","4"
"3613","C_325__33","C_325","","Дума","","Во дни тревог, стихий борений,","C. 324-325","col",21,"Iamb","4"
"3614","C_327__1","C_327","A_121","Наяда","","В серебре живом каскада,","C. 5","col",12,"Trochee","4"
