"","year","header","text_raw"
"145",1839,"Коса : «Я видел: бережно, за рамой, под стеклом...»","Я видел: бережно, за рамой, под стеклом, 
 Хранились древности остатки дорогие -- 
 Венцы блестящие, запястья золотые 
 И вазы чудные уставлены кругом, 
 И все, что отдали курганы и гробницы -- 
 Амфоры пирные и скорбные слезницы, 
 И все была свежа их редкая краса; 
 Но средь венцов и чаш, в роскошном их собранье, 
 Влекла к себе мое несытое вниманье 
 От женской головы отъятая коса, 
 Достойная любви, восторгов и стенаний, 
 Густая, черная, сплетенная в три грани, 
 Из страшной тьмы могил исшедшая на свет 
 И неизмятая под тысячами лет, 
 Меж тем как столько кос и с царственной красою 
 Иссеклось времени нещадною косою. 
 Нетленный блеск венцов меня не изумлял; 
 Не диво было мне, что эти диадимы 
 Прошли ряды веков, все в целости хранимы. 
 В них рдело золото -- прельстительный металл! 
 Он время соблазнит, и вечность он подкупит, 
 И та ему удел нетления уступит. 
 Но эта прядь волос... Ужели и она 
 Всевластной прелестью над временем сильна? 
 И вечность жадная на этот дар прекрасной 
 Глядела издали с улыбкой сладострастной? 
 Где ж светлые глаза той дивной головы, 
 С которой волосы остались нам?.. Увы! 
 Глаза... они весь мир, быть может, обольщали, 
 Диктаторов, царей и консулов смущали, 
 Огни кровавых войн вздувая и туша, 
 Глаза, где было все: свет, жизнь, любовь, душа, 
 Где лик небес сверкал, бессмертье пировало, -- 
 О, дайте мне узреть хоть их волшебный след! 
 И тихо выказал осклабленный скелет 
 На желтом черепе два страшные провала.


"
"146",1839,"Прости : «Прости, волшебный край, прости...»","Прости, волшебный край, прости! 
 На кратком жизненном пути 
 Едва ль тебя я снова встречу, 
 Да и зачем?.. я не замечу 
 И не найду в тебе тогда 
 Того, что видел ныне -- да! 
 Ты будешь цвесть, ты вечно молод, 
 А мне вторично -- не цвести: 
 Тогда в тебя вознес бы холод... 
 Прости, волшебный край, прости!


"
"147",1839,"Южная ночь : «Легкий сумрак. Сень акаций...»","Легкий сумрак. Сень акаций. 
 Берег моря, плеск волны; 
 И с лазурной вышины 
 Свет лампады муз и граций -- 
 Упоительной луны.


Там, чернея над заливом, 
 Мачт подъемлются леса; 
 На земли ж -- земли ж краса -- 
 Тополь ростом горделивым 
 Измеряет небеса.


Горячей дыханья девы, 
 Меж землей и небом сжат, 
 Сладкий воздух; в нем дрожат 
 Итальянские напевы; 
 В нем трепещет аромат.


А луна? -- Луна здесь греет, 
 Хочет солнцем быть луна; 
 Соблазнительно -- пышна 
 Грудь томит и чары деет 
 Блеском сладостным она.


Злая ночь златого юга! 
 Блещешь лютой ты красой: 
 Ты сменила холод мой 
 Жаром страшного недуга -- 
 Одиночества тоской.


Сердце, вспомнив сон заветной, 
 Жаждешь вновь -- кого-нибудь... 
 Тщетно! Не о ком вздохнуть! 
 И любовью беспредметной 
 Высоко взметалась грудь.


Прочь, томительная нега! 
 Там -- целебный север мой 
 Возвратит душе больной 
 В лоне вьюг, на глыбах снега 
 Силу мыслей и покой.


"
"148",1839,"К А-е П-е Г-г : «В стране, где ясными лучами...»","В стране, где ясными лучами 
 Живее плещут небеса, 
 Есть между морем и горами 
 Земли роскошной полоса. 
 Я там бродил, и дум порывы 
 Невольно к вам я устремлял, 
 Когда под лавры и оливы 
 Главу тревожную склонял. 
 Там часто я, в разгуле диком, 
 Широко плавая в мечтах, 
 Вас призывал безумным криком, -- 
 И эхо вторило в горах. 
 О вас я думал там, где влага 
 Фонтанов сладостных шумит, 
 Там, где гиганта -- Чатырдага 
 Глава над тучами парит, 
 Там, где по яхонту эфира 
 Гуляют вольные орлы, 
 Где путь себе хрусталь Салгира 
 Прошиб из мраморной скалы; -- 
 Там, средь природы колоссальной, 
 На высях гор, на ребрах скал, 
 Оставил я свой след печальной 
 И ваше имя начертал; 
 И после -- из долин метались 
 Мои глаза на высоты, 
 Где мною врезаны остались 
 Те драгоценные черты: 
 Они в лазури утопали, 
 А я смотрел издалека, 
 Как солнца там лучи играли 
 Или свивались облака.


Блеснет весна иного года, 
 И может быть в счастливый час 
 Тавриды смелая природа 
 В свои объятья примет вас. 
 Привычный к высям и оврагам, 
 Над дольней бездной, в свой черед, 
 Татарский конь надежным шагом 
 Вас в область молний вознесет -- 
 И вы найдете те скрижали, 
 Где, проясняя свой удел 
 И сердца тайные печали, 
 Я ваше имя впечатлел. 
 Быть может, это начертанье -- 
 Скалам мной вверенный залог -- 
 Пробудит в вас воспоминанье 
 О том, кто вас забыть не мог...


Но я боюсь: тех высей темя 
 Обвалом в бездну упадет, 
 Или завистливое время 
 Черты заветные сотрет, 
 Иль, кроя мраком свет лазури 
 И раздирая облака, 
 Изгладит их ревнивой бури 
 Неотразимая рука, -- 
 И не избегну я забвенья, 
 И, скрыта в прахе разрушенья, 
 Заветной надписи лишась, 
 Порой под вашими стопами 
 Мелькнет не узнанная вами 
 Могила дум моих об вас.


"
"149",1839,"Е. Н. Ш...ой : «Пируя праздник возвращенья...»","Пируя праздник возвращенья, 
 Обет мой выполнить спешу, 
 И юга светлого растенья 
 Я вам сердечно приношу. 
 Там флора пышная предстала 
 Мне в блеске новой красоты; 
 Я рвал цветы -- рука дрожала 
 И их застенчиво срывала: 
 Я не привык срывать цветы. 
 Они пред вами, где ж приветный, 
 Чудесный запах южных роз? 
 Увы! Безжизненный, безцветный 
 Я только прах их вам привез: 
 Отрыв от почвы им смертелен, 
 И вот из скудных сих даров 
 Лишь мох остался свеж и зелен 
 От чатырдагских ледников -- 
 Затем, что с ним не зналась нега; 
 Где солнца луч не забегал, 
 Он там над бездной льдов и снега 
 Утесов ребра пеленал; 
 Да моря чудные растенья, 
 Как вживе, странный образ свой 
 Хранят -- затем, что с дня рожденья 
 Они средь влаги и волненья 
 Знакомы с мрачной глубиной.


"
"150",1850,"Еще черные : «О, как быстра твоих очей...»","О, как быстра твоих очей 
 Огнем напитанная влага! 
 В них все -- и тысячи смертей 
 И море жизненного блага. 
 Они, одетые черно, 
 Горят во мраке сей одежды; 
 Сей траур им носить дано 
 По тем, которым суждено 
 От их погибнуть без надежды. 
 Быть может, в сумраке земном 
 Их пламя для того явилось, 
 Чтоб небо звезд твоих огнем 
 Перед землею не гордилось, 
 Или оттоль, где звезд ряды 
 Крестят эфир лучей браздами, 
 Упали белых две звезды 
 И стали черными звездами. 
 Порой, в таинственной тени, 
 Слегка склоненные, они, 
 Роняя трепетные взгляды, 
 Сияньем теплятся святым, 
 Как две глубокие лампады, 
 Елеем полные густым, -- 
 И укротив желаний битву 
 И бурю помыслов земных, 
 Поклонник в трепете при них 
 Становит сердце на молитву. 
 Порой в них страсть: ограждены 
 Двойными иглами ресницы, 
 Они на мир наведены 
 И смотрят ужасом темницы, 
 Где через эти два окна 
 Чернеет страшно глубина, -- 
 И поглотить мир целый хочет 
 Та всеобъемлющая мгла, 
 И там кипящая клокочет 
 Густая, черная смола; 
 Там ад; -- но муки роковые 
 Рад каждый взять себе на часть, 
 Чтоб только в этот ад попасть, 
 Проникнуть в бездны огневые, 
 Отдаться демонам во власть, 
 Истратить разом жизни силы, 
 Перекипеть, перегореть, 
 Кончаясь, трепетать и млеть, 
 И, как в бездонных две могилы, 
 Все в те глаза смотреть -- смотреть.


"
"151",1839,"Вот как это было : «Летом протекшим, при всходе румяного солнца...»","Летом протекшим, при всходе румяного солнца, 
 Я удалился к холмам благодатным. Селенье 
 Мирно, гляжу, почиваю над озером ясным. 
 Дай, посещу рыбарей простодушных обитель! 
 Вижу, пуста одинокая хижина. -- «Где же, 
 Добрые люди, жильцы этой хаты пустынной?» -- 
 Там, -- отвечали мне, -- там! -- И рукой указали 
 Путь к светловодному озеру. Тихо спустился 
 К берегу злачному я и узрел Николая -- 
 Рыбаря мирного: в мокрой одежде у брега 
 Плот он сколачивал, тяжкие бревна ворочал; 
 Ветром власы его были разметаны; лесы, 
 Крючья и гибкие трости -- орудия ловли -- 
 Возле покоились. Тут его юные чада 
 Одаль недвижно стояли и удили рыбу, 
 Оком прилежным судя, в созерцаньи глубоком, 
 Легкий, живой поплавок и движение зыби. 
 Знал я их: все они в старое время, бывало, 
 С высшим художеством знались, талантливы были, 
 Ведали книжное дело и всякую мудрость, -- 
 Бросили все -- и забавы, и жизнь городскую, 
 Утро и полдень и вечер проводят на ловле. 
 Странное дело! -- помыслил я -- что за причина? 
 Только помыслил -- челнок, погляжу, уж, отчалил, 
 Влажным лобзаньем целуются с озером весла: 
 Сам я не ведаю, как в челноке очутился. 
 Стали на якоре; дали мне уду; закинул: 
 Бич власяной расхлестнул рябоватые струйки, 
 Груз побежал в глубину, поплавок закачался, 
 Словно малютка в люльке хрустальной; невольно 
 Я загляделся на влагу струистую: сверху 
 Искры, а глубже -- так темно, таинственно, чудно, 
 Точно, как в очи красавицы смотришь, и взору 
 Взором любви глубина отвечает, скрывая 
 Уды зубристое жало в загадочных персях.


Вдруг -- задрожала рука -- поплавок окунулся, 
 Стукнуло сердце и замерло... Выдернул: окунь! 
 Бьется, трепещет на верном крючке и, сверкая, 
 Брызжет в лицо мне студеными перлами влаги. 
 Снова закинул... Уж солнце давно закатилось, 
 Лес потемнел, и затеплились божьи лампады -- 
 Звезды небесные, -- ловля еще продолжалась. 
 «Ваш я отныне, -- сказал рыбакам я любезным, -- 
 Брошу неверную лиру и деву забуду -- 
 Петую мной чернокудрую светлую деву, 
 Или -- быть может... опять проглянула надежда!.. 
 Удой поймаю ее вероломное сердце -- 
 Знаю: она из огня его бросила в воду. 
 Ваш я отныне -- смиренный сотрудник -- ваш рыбарь».


"
"152",1841,"Могила любви : «В груди у юноши есть гибельный вулкан...»","В груди у юноши есть гибельный вулкан. 
 Он пышет. Мир любви под пламенем построен. 
 Чредой прошли года; Везувий успокоен, 
 И в пепле погребен любовный Геркулан; 
 Под грудой лавы спят мечты, тоска и ревность; 
 Кипевший жизнью мир теперь -- немая древность. 
 И память, наконец, как хладный рудокоп, 
 Врываясь в глубину, средь тех развалин бродит, 
 Могилу шевелит, откапывает гроб 
 И мумию любви нетленную находит: 
 У мертвой на челе оттенки грез лежат; 
 Есть прелести еще в чертах оцепенелых; 
 В очах угаснувших блестят 
 Остатки слез окаменелых. 
 Из двух венков, ей брошенных в удел, 
 Один давно исчез, другой все свеж, как новый: 
 Венок из роз давно истлел, 
 И лишь один венок терновый 
 На вечных язвах уцелел. 
 Вотще и ласки дев и пламенные песни 
 Почившей говорят: восстань! изыдь! воскресни! 
 Ее не оживят ни силы женских чар, 
 Ни взор прельстительный, ни уст румяных лепет, 
 И электрический удар 
 В ней возбудит не огнь и жар, 
 А только судорожный трепет. 
 Кругом есть надписи; но тщетно жадный ум 
 Покрывшую их пыль сметает и тревожит, 
 Напрасно их грызет и гложет 
 Железный зуб голодных дум, 
 Когда и сердце их прочесть уже не может; 
 И факел уронив, и весь проникнут мглой, 
 Кривляясь в бешенстве пред спящею богиней, 
 В бессильи жалком разум злой 
 Кощунствует над древнею святыней.


"
"153",1842,"О, если б : «О, если б знал я наперед...»","О, если б знал я наперед, 
 Когда мой смертный час придет, 
 И знал, что тихо, без терзанья, 
 Я кончу путь существованья, -- 
 Я жил бы легче и смелей, 
 Страдал и плакал веселей, 
 Не только б жизнь мою злословил, 
 И постепенно бы готовил 
 Я душу слабую к концу, 
 Как деву к брачному венцу; 
 И каждый год, в тот день известной. 
 Собрав друзей семьею тесной 
 И пеня дружеский фиал, 
 Себе я сам бы отправлял 
 Среди отрадной вечеринки, 
 В зачет грядущего поминки, 
 Чтобы потом не заставлять 
 Себя по смерти поминать. 
 В последний год, в конце дороги, 
 Я свел бы все свои итоги, 
 Поверил все: мои грехи, 
 Мою любовь, мои стихи, 
 Что я слагал в тоске по милой 
 (Прости мне, боже, и помилуй! ) , 
 И может быть еще бы раз, 
 Припомнив пару черных глаз, 
 Да злые кудри девы дальной, 
 Ей брякнул рифмою прощальной. 
 Потом -- всему и всем поклон! 
 И, осмотрясь со всех сторон, 
 В последний раз бы в божьем мире 
 Раскланялся на все четыре, 
 Окинул взором неба синь, 
 Родным, друзьям, в раздумьи тихом 
 Сказал: не поминайте лихом! 
 Закрыл бы очи -- и аминь!


"
"154",1839,"Напрасные жертвы : «Степенных мудрецов уроки затвердив...»","Степенных мудрецов уроки затвердив, 
 Как вредны пламенные страсти, 
 С усилием я каждый их порыв 
 Старался покорить рассудка грозной власти; 
 С мечтой сердечною вступая в тяжкий спор, 
 Я чувству шел наперекор, 
 И может быть порой чистейшее участье 
 Созданий, милых мне, враждебно отвергал, 
 И где меня искало счастье -- 
 Я сам от счастья убегал.


Рассудок хладный! -- долго, строго 
 Я не без горя, не без слез 
 Тебе служил, и много, много 
 Кровавых жертв тебе принес; 
 Как в тайну высшего искусства, 
 Я вник в учение твое -- 
 И обокрал святыню чувства, 
 Ограбил сердце я свое; 
 И там, где жизнь порывом сильным 
 Из тесной рамы бытия 
 Стремилась выдвинуться, -- я 
 Грозил ей заступом могильным, 
 И злой грозой поражена 
 Стихала грустная она.


За жертвы трудные, за горькие лишенья 
 Ты чем мне заплатил, холодный, жалкий ум? 
 Зажег ли мне во тьме светильник утешенья 
 И много ли мне дал отрадных светлых дум? 
 Я с роком бился: что ж? -- Что вынес я из боя? 
 Я жизнь вверял тебе -- и не жил я вполне: 
 За жизнь мою ты дал ли мне 
 Хотя безжизненность покоя? 
 Нет, дни туманные мои 
 Полны, при проблесках минутных, 
 Печальных гроз, видений смутных 
 И темных призраков любви.


"
"155",1848,"Ответ : «Есть цветок: его на лире...»","Есть цветок: его на лире 
 Вечно б славить я готов. 
 Есть цветок: он в этом мире 
 Краше всех других цветов. 
 То цветок не однолетний: 
 Все милее, все приветней 
 Он растет из года в год 
 И, пленяя всю природу, 
 По восьмнадцатому году 
 Дивной прелестью цветет. 
 Поднимается он статно. 
 Шейка гибкая бела, 
 А головка ароматна, 
 И кудрява, и светла, 
 Он витает в свете горнем, 
 И мечтательно -- живой 
 Он не связан грязным корнем 
 С нашей бедною землей. 
 Не на стебле при дорожках 
 Неподвижно -- одинок -- 
 Нет, на двух летучих ножках 
 Вьется резвый тот цветок. 
 От невзгод зимы упрямой 
 Жизнь его сохранена 
 За двойною плотной рамой 
 Осторожного окна, 
 И, беспечный, он не слышит 
 Бурь, свистящих в хладной мгле: 
 Он в светлице негой дышит, 
 Рдеет в комнатном тепле. 
 Что за чудное растенье! 
 Тонок, хрупок каждый сгиб: 
 Лишь одно прикосновенье -- 
 И прекрасный цвет погиб; 
 Увлекая наши взоры, 
 Слабый, ищет он опоры... 
 Но -- смотрите: он порой, 
 Нежный, розово-лилейный 
 Дышит силой чародейной, 
 Колдовством и ворожбой; 
 Полный прелестей, он разом 
 Сердце ядом напоит, 
 Отуманит бедный разум 
 И прельстит, и улетит.


"
